,id,seek,start,end,text,tokens,temperature,avg_logprob,compression_ratio,no_speech_prob
2314,2314,717300,7182.2,7189.08, us more time we would have fixed them maybe it's true right seems seems awful convenient in hindsight,"[50823, 514, 517, 640, 356, 561, 423, 5969, 606, 3863, 340, 338, 2081, 826, 2331, 2331, 12659, 11282, 287, 36412, 51167]",0.0,-0.08849881161218402,1.7142857142857142,0.01091141626238823
2315,2315,717300,7189.08,7193.16, that throughout the entirety the first term well it seems like what you would say if you got caught,"[51167, 326, 3690, 262, 21818, 262, 717, 3381, 880, 340, 2331, 588, 644, 345, 561, 910, 611, 345, 1392, 4978, 51371]",0.0,-0.08849881161218402,1.7142857142857142,0.01091141626238823
2316,2316,717300,7194.44,7202.04, right right right um but look uh in if we're being the most generous uh that we are here,"[51435, 826, 826, 826, 23781, 475, 804, 21480, 287, 611, 356, 821, 852, 262, 749, 14431, 21480, 326, 356, 389, 994, 51815]",0.0,-0.08849881161218402,1.7142857142857142,0.01091141626238823
2317,2317,720204,7202.68,7208.6, the president is briefed on real and legitimate threats and they scare the hell out of them i'm,"[50395, 262, 1893, 318, 32664, 319, 1103, 290, 9829, 7432, 290, 484, 19437, 262, 5968, 503, 286, 606, 1312, 1101, 50691]",0.0,-0.06695103430533195,1.7802197802197801,6.251471495488659e-05
2318,2318,720204,7208.6,7213.8, sure um and we can we can all imagine being there right those those of us who remember what the,"[50691, 1654, 23781, 290, 356, 460, 356, 460, 477, 5967, 852, 612, 826, 883, 883, 286, 514, 508, 3505, 644, 262, 50951]",0.0,-0.06695103430533195,1.7802197802197801,6.251471495488659e-05
2319,2319,720204,7213.8,7219.64, world was like post 9-11 fear is a powerful thing but the guys who are doing that briefing,"[50951, 995, 373, 588, 1281, 860, 12, 1157, 3252, 318, 257, 3665, 1517, 475, 262, 3730, 508, 389, 1804, 326, 17719, 51243]",0.0,-0.06695103430533195,1.7802197802197801,6.251471495488659e-05
2320,2320,720204,7221.48,7225.88, they're no longer scared of it uh because they've been dealing with this for years this is the oldest,"[51335, 484, 821, 645, 2392, 12008, 286, 340, 21480, 780, 484, 1053, 587, 7219, 351, 428, 329, 812, 428, 318, 262, 13325, 51555]",0.0,-0.06695103430533195,1.7802197802197801,6.251471495488659e-05
2321,2321,720204,7225.88,7230.04, thing they've given this briefing times before you know when we talk about people talk about the deep,"[51555, 1517, 484, 1053, 1813, 428, 17719, 1661, 878, 345, 760, 618, 356, 1561, 546, 661, 1561, 546, 262, 2769, 51763]",0.0,-0.06695103430533195,1.7802197802197801,6.251471495488659e-05
2322,2322,723004,7230.04,7236.12, state right they they talk about it like some conspiracy of lizard people it it's not that it's,"[50363, 1181, 826, 484, 484, 1561, 546, 340, 588, 617, 10086, 286, 42406, 661, 340, 340, 338, 407, 326, 340, 338, 50667]",0.0,-0.07932990893983004,1.964705882352941,0.001091575133614242
2323,2323,723004,7236.12,7241.08, something much simpler the deep state is simply the career government it's the people who are in the,"[50667, 1223, 881, 18599, 262, 2769, 1181, 318, 2391, 262, 3451, 1230, 340, 338, 262, 661, 508, 389, 287, 262, 50915]",0.0,-0.07932990893983004,1.964705882352941,0.001091575133614242
2324,2324,723004,7241.08,7247.4, same offices who outlive and outlast presidencies right they've seen republicans they've seen democrats,"[50915, 976, 9730, 508, 503, 12583, 290, 503, 12957, 906, 312, 3976, 826, 484, 1053, 1775, 17146, 504, 484, 1053, 1775, 5084, 1381, 51231]",0.0,-0.07932990893983004,1.964705882352941,0.001091575133614242
2325,2325,723004,7247.4,7253.16, they don't really care uh and they give that same briefing again and again and they get good at it,"[51231, 484, 836, 470, 1107, 1337, 21480, 290, 484, 1577, 326, 976, 17719, 757, 290, 757, 290, 484, 651, 922, 379, 340, 51519]",0.0,-0.07932990893983004,1.964705882352941,0.001091575133614242
2326,2326,723004,7253.16,7259.0, they know what they want they know what this person's saying uh whereas the president they don't know,"[51519, 484, 760, 644, 484, 765, 484, 760, 644, 428, 1048, 338, 2282, 21480, 9472, 262, 1893, 484, 836, 470, 760, 51811]",0.0,-0.07932990893983004,1.964705882352941,0.001091575133614242
2327,2327,725900,7259.0,7263.08, who these people are uh these people have been there before the president they're going to be,"[50363, 508, 777, 661, 389, 21480, 777, 661, 423, 587, 612, 878, 262, 1893, 484, 821, 1016, 284, 307, 50567]",0.0,-0.09928121005787569,1.7716894977168949,0.00023075084027368575
2328,2328,725900,7263.08,7269.8, there after the president and so they give this very effective very fear inducing speech and then,"[50567, 612, 706, 262, 1893, 290, 523, 484, 1577, 428, 845, 4050, 845, 3252, 44561, 4046, 290, 788, 50903]",0.0,-0.09928121005787569,1.7716894977168949,0.00023075084027368575
2329,2329,725900,7269.8,7278.36, they followed up with their asks which are really demands um just politely provided and anyone in,"[50903, 484, 3940, 510, 351, 511, 7893, 543, 389, 1107, 8665, 23781, 655, 34313, 2810, 290, 2687, 287, 51331]",0.0,-0.09928121005787569,1.7716894977168949,0.00023075084027368575
2330,2330,725900,7278.36,7286.2, that position who is not an expert on this stuff who is not ready for this uh uh sort of trade-off,"[51331, 326, 2292, 508, 318, 407, 281, 5887, 319, 428, 3404, 508, 318, 407, 3492, 329, 428, 21480, 21480, 3297, 286, 3292, 12, 2364, 51723]",0.0,-0.09928121005787569,1.7716894977168949,0.00023075084027368575
2331,2331,728620,7286.2,7292.28, and who you have to understand as a career politician is entirely used to the horse trading,"[50363, 290, 508, 345, 423, 284, 1833, 355, 257, 3451, 14971, 318, 5000, 973, 284, 262, 8223, 7313, 50667]",0.0,-0.08636743031191023,1.6666666666666667,0.000740209361538291
2332,2332,728620,7292.28,7297.24, game right and go and i'll deal with this later or not now or uh what are the this the cost benefit,"[50667, 983, 826, 290, 467, 290, 1312, 1183, 1730, 351, 428, 1568, 393, 407, 783, 393, 21480, 644, 389, 262, 428, 262, 1575, 4414, 50915]",0.0,-0.08636743031191023,1.6666666666666667,0.000740209361538291
2333,2333,728620,7297.24,7303.8, here and the intelligence community goes if you give us what we want no one will ever know about,"[50915, 994, 290, 262, 4430, 2055, 2925, 611, 345, 1577, 514, 644, 356, 765, 645, 530, 481, 1683, 760, 546, 51243]",0.0,-0.08636743031191023,1.6666666666666667,0.000740209361538291
2334,2334,728620,7303.8,7311.96, it because it's classified it's obviously the easy answer and maybe uh barack obama and honestly,"[51243, 340, 780, 340, 338, 10090, 340, 338, 6189, 262, 2562, 3280, 290, 3863, 21480, 2318, 441, 909, 1689, 290, 12698, 51651]",0.0,-0.08636743031191023,1.6666666666666667,0.000740209361538291
2335,2335,731196,7311.96,7319.4800000000005, did want to get to this later but what we can say today is uh uh for all the good that may have been,"[50363, 750, 765, 284, 651, 284, 428, 1568, 475, 644, 356, 460, 910, 1909, 318, 21480, 21480, 329, 477, 262, 922, 326, 743, 423, 587, 50739]",0.0,-0.07867523379947829,1.738938053097345,0.008974265307188034
2336,2336,731196,7319.4800000000005,7325.8, done in that white house uh this is an issue where the president went through two full terms and did,"[50739, 1760, 287, 326, 2330, 2156, 21480, 428, 318, 281, 2071, 810, 262, 1893, 1816, 832, 734, 1336, 2846, 290, 750, 51055]",0.0,-0.07867523379947829,1.738938053097345,0.008974265307188034
2337,2337,731196,7325.8,7331.72, not fix the problem but in fact made it worse well it seems like the president has a job that's,"[51055, 407, 4259, 262, 1917, 475, 287, 1109, 925, 340, 4785, 880, 340, 2331, 588, 262, 1893, 468, 257, 1693, 326, 338, 51351]",0.0,-0.07867523379947829,1.738938053097345,0.008974265307188034
2338,2338,731196,7331.72,7336.6, absolutely impossible and if you come across someone who has been in the position like you know,"[51351, 5543, 5340, 290, 611, 345, 1282, 1973, 2130, 508, 468, 587, 287, 262, 2292, 588, 345, 760, 51595]",0.0,-0.07867523379947829,1.738938053097345,0.008974265307188034
2339,2339,733660,7336.6,7342.360000000001, someone who's the head of an intelligence agency for a long time and is very persuasive and has,"[50363, 2130, 508, 338, 262, 1182, 286, 281, 4430, 4086, 329, 257, 890, 640, 290, 318, 845, 40116, 290, 468, 50651]",0.0,-0.055529882323067145,1.8178438661710037,0.0008529404294677079
2340,2340,733660,7342.360000000001,7346.84, some you know legitimate credentials that show that he's very good at his job but he tells you,"[50651, 617, 345, 760, 9829, 18031, 326, 905, 326, 339, 338, 845, 922, 379, 465, 1693, 475, 339, 4952, 345, 50875]",0.0,-0.055529882323067145,1.8178438661710037,0.0008529404294677079
2341,2341,733660,7346.84,7352.92, this is important for national security we need to keep these things in place it doesn't seem like,"[50875, 428, 318, 1593, 329, 2260, 2324, 356, 761, 284, 1394, 777, 1243, 287, 1295, 340, 1595, 470, 1283, 588, 51179]",0.0,-0.055529882323067145,1.8178438661710037,0.0008529404294677079
2342,2342,733660,7352.92,7358.76, any one person can run the country and be aware of every single program that every single agency,"[51179, 597, 530, 1048, 460, 1057, 262, 1499, 290, 307, 3910, 286, 790, 2060, 1430, 326, 790, 2060, 4086, 51471]",0.0,-0.055529882323067145,1.8178438661710037,0.0008529404294677079
2343,2343,733660,7358.76,7364.68, is implementing it it seems completely unrealistic and the the job itself it just it doesn't seem like,"[51471, 318, 15427, 340, 340, 2331, 3190, 31363, 290, 262, 262, 1693, 2346, 340, 655, 340, 1595, 470, 1283, 588, 51767]",0.0,-0.055529882323067145,1.8178438661710037,0.0008529404294677079
2344,2344,736468,7364.76,7370.200000000001, any person can do it adequately and when it comes to something like this mass surveillance state,"[50367, 597, 1048, 460, 466, 340, 22668, 290, 618, 340, 2058, 284, 1223, 588, 428, 2347, 8452, 1181, 50639]",0.0,-0.09515025398947975,1.7777777777777777,0.00035591484629549086
2345,2345,736468,7371.88,7379.56, I could see a president being persuaded by someone who comes to him and says this is why we need to do,"[50723, 314, 714, 766, 257, 1893, 852, 25562, 416, 2130, 508, 2058, 284, 683, 290, 1139, 428, 318, 1521, 356, 761, 284, 466, 51107]",0.0,-0.09515025398947975,1.7777777777777777,0.00035591484629549086
2346,2346,736468,7379.56,7388.76, this yeah I mean it one of the things that I think is uh the underlying problem and everything that,"[51107, 428, 10194, 314, 1612, 340, 530, 286, 262, 1243, 326, 314, 892, 318, 21480, 262, 10238, 1917, 290, 2279, 326, 51567]",0.0,-0.09515025398947975,1.7777777777777777,0.00035591484629549086
2347,2347,736468,7388.76,7393.88, you just described is the president has too much power right um and because they have too much power,"[51567, 345, 655, 3417, 318, 262, 1893, 468, 1165, 881, 1176, 826, 23781, 290, 780, 484, 423, 1165, 881, 1176, 51823]",0.0,-0.09515025398947975,1.7777777777777777,0.00035591484629549086
2348,2348,739388,7393.88,7399.8, that means they have too much responsibility and I don't think people understand if they haven't,"[50363, 326, 1724, 484, 423, 1165, 881, 5798, 290, 314, 836, 470, 892, 661, 1833, 611, 484, 4398, 470, 50659]",0.0,-0.10926561128525507,1.6443514644351465,0.0001638758258195594
2349,2349,739388,7399.8,7404.6, lived outside the United States if they haven't sort of traveled or studied broadly just how,"[50659, 5615, 2354, 262, 1578, 1829, 611, 484, 4398, 470, 3297, 286, 14113, 393, 9713, 18633, 655, 703, 50899]",0.0,-0.10926561128525507,1.6443514644351465,0.0001638758258195594
2350,2350,739388,7404.6,7412.2, exceptional the American presidency is most countries don't have a single individual with this level of,"[50899, 15313, 262, 1605, 12112, 318, 749, 2678, 836, 470, 423, 257, 2060, 1981, 351, 428, 1241, 286, 51279]",0.0,-0.10926561128525507,1.6443514644351465,0.0001638758258195594
2351,2351,739388,7412.2,7421.96, power it's really only the super states and and that may be uh by design perhaps that's why they're,"[51279, 1176, 340, 338, 1107, 691, 262, 2208, 2585, 290, 290, 326, 743, 307, 21480, 416, 1486, 3737, 326, 338, 1521, 484, 821, 51767]",0.0,-0.10926561128525507,1.6443514644351465,0.0001638758258195594
2352,2352,742196,7421.96,7429.16, they're super states um but when we look at uh sort of complex advanced democracies that are,"[50363, 484, 821, 2208, 2585, 23781, 475, 618, 356, 804, 379, 21480, 3297, 286, 3716, 6190, 40416, 326, 389, 50723]",0.0,-0.07742045879364014,1.7703703703703704,0.00041575395152904093
2353,2353,742196,7429.16,7435.64, more peaceful uh they tend to have a more multilateral system that has more people involved in smaller,"[50723, 517, 12309, 21480, 484, 4327, 284, 423, 257, 517, 1963, 14796, 1080, 326, 468, 517, 661, 2950, 287, 4833, 51047]",0.0,-0.07742045879364014,1.7703703703703704,0.00041575395152904093
2354,2354,742196,7435.64,7440.2, portfolios and a lot of this derives from just the size of the government like like you said you,"[51047, 47837, 290, 257, 1256, 286, 428, 37453, 422, 655, 262, 2546, 286, 262, 1230, 588, 588, 345, 531, 345, 51275]",0.0,-0.07742045879364014,1.7703703703703704,0.00041575395152904093
2355,2355,742196,7440.2,7443.8, know the president is responsible for basically everything executive branch and the executive,"[51275, 760, 262, 1893, 318, 4497, 329, 6209, 2279, 4640, 8478, 290, 262, 4640, 51455]",0.0,-0.07742045879364014,1.7703703703703704,0.00041575395152904093
2356,2356,742196,7443.8,7451.88, branch is basically every agency that actually doesn't work um and so how do you how do you,"[51455, 8478, 318, 6209, 790, 4086, 326, 1682, 1595, 470, 670, 23781, 290, 523, 703, 466, 345, 703, 466, 345, 51859]",0.0,-0.07742045879364014,1.7703703703703704,0.00041575395152904093
2357,2357,745188,7451.88,7457.4800000000005, correct for that uh without breaking it up where you have uh smaller ministers and ministries and,"[50363, 3376, 329, 326, 21480, 1231, 7163, 340, 510, 810, 345, 423, 21480, 4833, 14138, 290, 45933, 290, 50643]",0.0,-0.0907949556278277,1.7142857142857142,0.00035088398726657033
2358,2358,745188,7457.4800000000005,7462.2, things like that that have different levels of responsibility having a smaller government overall,"[50643, 1243, 588, 326, 326, 423, 1180, 2974, 286, 5798, 1719, 257, 4833, 1230, 4045, 50879]",0.0,-0.0907949556278277,1.7142857142857142,0.00035088398726657033
2359,2359,745188,7462.2,7470.2, you know back in 1776 uh the federal government you know was pretty much a dream we weren't even,"[50879, 345, 760, 736, 287, 1596, 4304, 21480, 262, 2717, 1230, 345, 760, 373, 2495, 881, 257, 4320, 356, 6304, 470, 772, 51279]",0.0,-0.0907949556278277,1.7142857142857142,0.00035088398726657033
2360,2360,745188,7471.24,7476.6, interested in having standing armies the idea of an army that existed from year to year was,"[51331, 4609, 287, 1719, 5055, 18837, 262, 2126, 286, 281, 5428, 326, 11196, 422, 614, 284, 614, 373, 51599]",0.0,-0.0907949556278277,1.7142857142857142,0.00035088398726657033
2361,2361,747660,7476.68,7484.76, terrifying forbidding thing um and then when you moved this idea that we have a president that,"[50367, 17623, 11747, 13494, 1517, 23781, 290, 788, 618, 345, 3888, 428, 2126, 326, 356, 423, 257, 1893, 326, 50771]",0.0,-0.10958071474759083,1.821969696969697,0.0028470109682530165
2362,2362,747660,7484.76,7488.84, they have these extraordinary powers it's okay because the government is very small the federal,"[50771, 484, 423, 777, 11359, 5635, 340, 338, 8788, 780, 262, 1230, 318, 845, 1402, 262, 2717, 50975]",0.0,-0.10958071474759083,1.821969696969697,0.0028470109682530165
2363,2363,747660,7488.84,7493.240000000001, government especially is seen as sort of this small and toothless and weak thing keep pause for,"[50975, 1230, 2592, 318, 1775, 355, 3297, 286, 428, 1402, 290, 16162, 1203, 290, 4939, 1517, 1394, 14985, 329, 51195]",0.0,-0.10958071474759083,1.821969696969697,0.0028470109682530165
2364,2364,747660,7493.240000000001,7498.360000000001, one second pause for one second because my air pods are about to die and i'm gonna swap over to,"[51195, 530, 1218, 14985, 329, 530, 1218, 780, 616, 1633, 37185, 389, 546, 284, 4656, 290, 1312, 1101, 8066, 16075, 625, 284, 51451]",0.0,-0.10958071474759083,1.821969696969697,0.0028470109682530165
2365,2365,747660,7498.360000000001,7504.04, another pair these these suckers are good for a couple hours but we're uh two hours and 15 minutes,"[51451, 1194, 5166, 777, 777, 10110, 364, 389, 922, 329, 257, 3155, 2250, 475, 356, 821, 21480, 734, 2250, 290, 1315, 2431, 51735]",0.0,-0.10958071474759083,1.821969696969697,0.0028470109682530165
2366,2366,750404,7504.04,7509.48, here we'll have a little bit of a weird uh audio issue with the last half of it but Jamie,"[50363, 994, 356, 1183, 423, 257, 1310, 1643, 286, 257, 7650, 21480, 6597, 2071, 351, 262, 938, 2063, 286, 340, 475, 17826, 50635]",0.0,-0.121111572429698,1.6473214285714286,0.011580494232475758
2367,2367,750404,7509.48,7514.92, Jamie will take care of it um i wanted to talk about you like where you are right now in your,"[50635, 17826, 481, 1011, 1337, 286, 340, 23781, 1312, 2227, 284, 1561, 546, 345, 588, 810, 345, 389, 826, 783, 287, 534, 50907]",0.0,-0.121111572429698,1.6473214285714286,0.011580494232475758
2368,2368,750404,7514.92,7520.2, life and how you're handling this because yeah you've been in exile for how many years now,"[50907, 1204, 290, 703, 345, 821, 9041, 428, 780, 10194, 345, 1053, 587, 287, 24329, 329, 703, 867, 812, 783, 51171]",0.0,-0.121111572429698,1.6473214285714286,0.011580494232475758
2369,2369,750404,7521.48,7529.48, it's been more than six years six six years of 2013 yeah i mean well actually i left uh may so,"[51235, 340, 338, 587, 517, 621, 2237, 812, 2237, 2237, 812, 286, 2211, 10194, 1312, 1612, 880, 1682, 1312, 1364, 21480, 743, 523, 51635]",0.0,-0.121111572429698,1.6473214285714286,0.011580494232475758
2370,2370,752948,7529.48,7537.16, what is life like i mean are you in constant hiding i mean what what are the issues like,"[50363, 644, 318, 1204, 588, 1312, 1612, 389, 345, 287, 6937, 11816, 1312, 1612, 644, 644, 389, 262, 2428, 588, 50747]",0.0,-0.11468681097030639,1.806930693069307,0.0005284900544211268
2371,2371,752948,7538.36,7546.599999999999, in in the beginning um my operational security level as we would call it was was very high,"[50807, 287, 287, 262, 3726, 23781, 616, 13919, 2324, 1241, 355, 356, 561, 869, 340, 373, 373, 845, 1029, 51219]",0.0,-0.11468681097030639,1.806930693069307,0.0005284900544211268
2372,2372,752948,7547.24,7552.36, uh i was concerned uh about being recognized i was concerned about being followed i was,"[51251, 21480, 1312, 373, 5213, 21480, 546, 852, 8018, 1312, 373, 5213, 546, 852, 3940, 1312, 373, 51507]",0.0,-0.11468681097030639,1.806930693069307,0.0005284900544211268
2373,2373,752948,7552.36,7558.36, concerned uh really about very bad things happening to me because the the government made it very,"[51507, 5213, 21480, 1107, 546, 845, 2089, 1243, 5836, 284, 502, 780, 262, 262, 1230, 925, 340, 845, 51807]",0.0,-0.11468681097030639,1.806930693069307,0.0005284900544211268
2374,2374,755836,7558.44,7563.5599999999995, clear that from their position i was the most wanted man in the world um they literally brought,"[50367, 1598, 326, 422, 511, 2292, 1312, 373, 262, 749, 2227, 582, 287, 262, 995, 23781, 484, 7360, 3181, 50623]",0.0,-0.09091716342502171,1.711111111111111,0.0004585089336615056
2375,2375,755836,7563.5599999999995,7571.4, down uh the president of Bolivia uh his aircraft and would not let it depart is it tried to cross,"[50623, 866, 21480, 262, 1893, 286, 38496, 21480, 465, 6215, 290, 561, 407, 1309, 340, 6313, 318, 340, 3088, 284, 3272, 51015]",0.0,-0.09091716342502171,1.711111111111111,0.0004585089336615056
2376,2376,755836,7571.4,7576.5199999999995, the airspace of europe not even the united states uh they wouldn't let it leave until they,"[51015, 262, 34216, 286, 11063, 431, 407, 772, 262, 16503, 2585, 21480, 484, 3636, 470, 1309, 340, 2666, 1566, 484, 51271]",0.0,-0.09091716342502171,1.711111111111111,0.0004585089336615056
2377,2377,755836,7576.5199999999995,7583.5599999999995, confirmed i was not on board um so yeah that made me a little bit nervous but you can't live uh like,"[51271, 4999, 1312, 373, 407, 319, 3096, 23781, 523, 10194, 326, 925, 502, 257, 1310, 1643, 10927, 475, 345, 460, 470, 2107, 21480, 588, 51623]",0.0,-0.09091716342502171,1.711111111111111,0.0004585089336615056
2378,2378,758356,7583.56,7591.4800000000005, that forever and although i was as careful as i could be um i i still lived uh pretty happily,"[50363, 326, 8097, 290, 3584, 1312, 373, 355, 8161, 355, 1312, 714, 307, 23781, 1312, 1312, 991, 5615, 21480, 2495, 18177, 50759]",0.0,-0.09001781585368704,1.7431192660550459,0.014647054485976696
2379,2379,758356,7591.4800000000005,7595.64, because i was an indoor cat to begin with right i've always been a technologist i've always been,"[50759, 780, 1312, 373, 281, 22639, 3797, 284, 2221, 351, 826, 1312, 1053, 1464, 587, 257, 1579, 7451, 1312, 1053, 1464, 587, 50967]",0.0,-0.09001781585368704,1.7431192660550459,0.014647054485976696
2380,2380,758356,7595.64,7601.080000000001, uh pretty nerdy um so as long as i have a screen and an internet connection i was pretty happy,"[50967, 21480, 2495, 17156, 9892, 23781, 523, 355, 890, 355, 1312, 423, 257, 3159, 290, 281, 5230, 4637, 1312, 373, 2495, 3772, 51239]",0.0,-0.09001781585368704,1.7431192660550459,0.014647054485976696
2381,2381,758356,7601.8,7608.280000000001, um but in the years past my life has become more and more open you know now i i speak openly i,"[51275, 23781, 475, 287, 262, 812, 1613, 616, 1204, 468, 1716, 517, 290, 517, 1280, 345, 760, 783, 1312, 1312, 2740, 11764, 1312, 51599]",0.0,-0.09001781585368704,1.7431192660550459,0.014647054485976696
2382,2382,760828,7608.28,7613.719999999999, live openly i go out i ride the metro i go to restaurants i go you know how often he recognized,"[50363, 2107, 11764, 1312, 467, 503, 1312, 6594, 262, 24536, 1312, 467, 284, 10808, 1312, 467, 345, 760, 703, 1690, 339, 8018, 50635]",0.0,-0.0986957068395133,1.7477477477477477,0.0064697726629674435
2383,2383,760828,7615.24,7620.679999999999, so this is a funny thing is i'm almost never recognized um one of those things is i don't give,"[50711, 523, 428, 318, 257, 8258, 1517, 318, 1312, 1101, 2048, 1239, 8018, 23781, 530, 286, 883, 1243, 318, 1312, 836, 470, 1577, 50983]",0.0,-0.0986957068395133,1.7477477477477477,0.0064697726629674435
2384,2384,760828,7620.679999999999,7628.28, uh russian interviews um because i i don't want my face all over the news um which is nice because,"[50983, 21480, 374, 31562, 9299, 23781, 780, 1312, 1312, 836, 470, 765, 616, 1986, 477, 625, 262, 1705, 23781, 543, 318, 3621, 780, 51363]",0.0,-0.0986957068395133,1.7477477477477477,0.0064697726629674435
2385,2385,760828,7628.28,7636.92, it just allows people to to sort of forget about my face um and i can uh go about my life but uh i,"[51363, 340, 655, 3578, 661, 284, 284, 3297, 286, 6044, 546, 616, 1986, 23781, 290, 1312, 460, 21480, 467, 546, 616, 1204, 475, 21480, 1312, 51795]",0.0,-0.0986957068395133,1.7477477477477477,0.0064697726629674435
2386,2386,763692,7637.24,7640.76, it's one of the weird things that i'm recognized a couple times a year,"[50379, 340, 338, 530, 286, 262, 7650, 1243, 326, 1312, 1101, 8018, 257, 3155, 1661, 257, 614, 50555]",0.0,-0.122850623997775,1.7116279069767442,0.0009249182185158134
2387,2387,763692,7642.04,7648.92, even when i'm i'm not wearing my glasses uh in a museum or a grocery store or something like that,"[50619, 772, 618, 1312, 1101, 1312, 1101, 407, 5762, 616, 15232, 21480, 287, 257, 13257, 393, 257, 16918, 3650, 393, 1223, 588, 326, 50963]",0.0,-0.122850623997775,1.7116279069767442,0.0009249182185158134
2388,2388,763692,7648.92,7655.0, or out on the street just by somebody who i swear like these people are are you might have read a,"[50963, 393, 503, 319, 262, 4675, 655, 416, 8276, 508, 1312, 21192, 588, 777, 661, 389, 389, 345, 1244, 423, 1100, 257, 51267]",0.0,-0.122850623997775,1.7116279069767442,0.0009249182185158134
2389,2389,763692,7655.0,7660.92, story about them like super recognizers the people just have a great memory for faces yeah uh because,"[51267, 1621, 546, 606, 588, 2208, 3018, 11341, 262, 661, 655, 423, 257, 1049, 4088, 329, 6698, 10194, 21480, 780, 51563]",0.0,-0.122850623997775,1.7116279069767442,0.0009249182185158134
2390,2390,766092,7661.88,7667.56, i can be like aware in a hood and like a jacket it can have a scarf around my face like in the,"[50411, 1312, 460, 307, 588, 3910, 287, 257, 14263, 290, 588, 257, 15224, 340, 460, 423, 257, 36953, 1088, 616, 1986, 588, 287, 262, 50695]",0.0,-0.13623189454031462,1.8564356435643565,0.00013909334666095674
2391,2391,766092,7667.56,7673.16, winter and it like you can barely see my face and they'll come up to me and they're like are you,"[50695, 7374, 290, 340, 588, 345, 460, 8523, 766, 616, 1986, 290, 484, 1183, 1282, 510, 284, 502, 290, 484, 821, 588, 389, 345, 50975]",0.0,-0.13623189454031462,1.8564356435643565,0.00013909334666095674
2392,2392,766092,7674.2,7679.4, snowing and i'm like whoa you know that's what do you say that's pretty impressive i'd say yeah,"[51027, 6729, 278, 290, 1312, 1101, 588, 508, 64, 345, 760, 326, 338, 644, 466, 345, 910, 326, 338, 2495, 8036, 1312, 1549, 910, 10194, 51287]",0.0,-0.13623189454031462,1.8564356435643565,0.00013909334666095674
2393,2393,766092,7680.12,7686.28, it's nice to meet you um and uh yeah they've it's i've never had a negative interaction,"[51323, 340, 338, 3621, 284, 1826, 345, 23781, 290, 21480, 10194, 484, 1053, 340, 338, 1312, 1053, 1239, 550, 257, 4633, 10375, 51631]",0.0,-0.13623189454031462,1.8564356435643565,0.00013909334666095674
