,id,seek,start,end,text,tokens,temperature,avg_logprob,compression_ratio,no_speech_prob
742,742,356080,3579.84,3585.44," Well, it's gonna be safe for sure. We're at Disney World. Yeah, they've done a great job making sure there's not monsters living in a pond","[51315, 3894, 11, 340, 338, 8066, 307, 3338, 329, 1654, 13, 775, 821, 379, 8519, 2159, 13, 9425, 11, 484, 1053, 1760, 257, 1049, 1693, 1642, 1654, 612, 338, 407, 10963, 2877, 287, 257, 16723, 51595]",0.0,-0.2856925427913666,1.8,0.0006529871025122702
743,743,356080,3585.44,3588.32," Yeah, nope. No, there's monsters in that pond","[51595, 9425, 11, 299, 3008, 13, 1400, 11, 612, 338, 10963, 287, 326, 16723, 51739]",0.0,-0.2856925427913666,1.8,0.0006529871025122702
744,744,358832,3588.96,3593.56, Fucking alligator came out and ate their kid. Look at this motherfucker. That's a motherfucker,"[50395, 376, 19296, 477, 23823, 1625, 503, 290, 15063, 511, 5141, 13, 6803, 379, 428, 2802, 69, 12603, 13, 1320, 338, 257, 2802, 69, 12603, 50625]",0.0,-0.28292557799700396,1.6929460580912863,0.003814215073361993
745,745,358832,3595.1200000000003,3598.48, This is a different one this but they have video of this bro,"[50703, 770, 318, 257, 1180, 530, 428, 475, 484, 423, 2008, 286, 428, 1379, 50871]",0.0,-0.28292557799700396,1.6929460580912863,0.003814215073361993
746,746,358832,3598.48,3604.2400000000002, These people are standing just a few feet away from a goddamn dinosaur with a brain the size of a quarter,"[50871, 2312, 661, 389, 5055, 655, 257, 1178, 3625, 1497, 422, 257, 43546, 28257, 351, 257, 3632, 262, 2546, 286, 257, 3860, 51159]",0.0,-0.28292557799700396,1.6929460580912863,0.003814215073361993
747,747,358832,3604.48,3609.76, I think doesn't give a fuck about you or your babies or your kids or you're just lucky,"[51171, 314, 892, 1595, 470, 1577, 257, 5089, 546, 345, 393, 534, 11903, 393, 534, 3988, 393, 345, 821, 655, 9670, 51435]",0.0,-0.28292557799700396,1.6929460580912863,0.003814215073361993
748,748,358832,3610.0800000000004,3613.92, You're lucky that dinosaur doesn't just the size of a human,"[51451, 921, 821, 9670, 326, 28257, 1595, 470, 655, 262, 2546, 286, 257, 1692, 51643]",0.0,-0.28292557799700396,1.6929460580912863,0.003814215073361993
749,749,361392,3614.32,3617.6800000000003," Yeah, it's so they're so big and that's not even a huge one","[50383, 9425, 11, 340, 338, 523, 484, 821, 523, 1263, 290, 326, 338, 407, 772, 257, 3236, 530, 50551]",0.0,-0.18760726411463852,1.7666666666666666,0.0014608907513320446
750,750,361392,3617.84,3620.56, There's there's a video one in Florida walking across a golf court,"[50559, 1318, 338, 612, 338, 257, 2008, 530, 287, 4744, 6155, 1973, 257, 13126, 2184, 50695]",0.0,-0.18760726411463852,1.7666666666666666,0.0014608907513320446
751,751,361392,3620.56,3626.56, It's 15 feet long and you see it and these guys are in awe. They're like what the fuck they're there,"[50695, 632, 338, 1315, 3625, 890, 290, 345, 766, 340, 290, 777, 3730, 389, 287, 25030, 13, 1119, 821, 588, 644, 262, 5089, 484, 821, 612, 50995]",0.0,-0.18760726411463852,1.7666666666666666,0.0014608907513320446
752,752,361392,3626.56,3634.08, They're out there playing golf in a legitimate dinosaur walks by 15 foot long alligator. It's so big,"[50995, 1119, 821, 503, 612, 2712, 13126, 287, 257, 9829, 28257, 11114, 416, 1315, 2366, 890, 477, 23823, 13, 632, 338, 523, 1263, 51371]",0.0,-0.18760726411463852,1.7666666666666666,0.0014608907513320446
753,753,361392,3634.64,3639.44, It's so big dude. It's like look at it. Look at that thing. Look at that. Yes. Yes. Holy Christ,"[51399, 632, 338, 523, 1263, 18396, 13, 632, 338, 588, 804, 379, 340, 13, 6803, 379, 326, 1517, 13, 6803, 379, 326, 13, 3363, 13, 3363, 13, 7439, 1951, 51639]",0.0,-0.18760726411463852,1.7666666666666666,0.0014608907513320446
754,754,363944,3639.76,3644.7200000000003, Holy Christ. Look how big that is on the golf course bro. Look how big that is,"[50379, 7439, 1951, 13, 6803, 703, 1263, 326, 318, 319, 262, 13126, 1781, 1379, 13, 6803, 703, 1263, 326, 318, 50627]",0.0,-0.2998115269824712,1.5772727272727274,0.0012431038776412606
755,755,363944,3645.44,3652.96," Look at the size of that thing. Yeah, holy shit, man. Your balls struck my foot. Holy fuck that thing so big","[50663, 6803, 379, 262, 2546, 286, 326, 1517, 13, 9425, 11, 11386, 7510, 11, 582, 13, 3406, 11333, 7425, 616, 2366, 13, 7439, 5089, 326, 1517, 523, 1263, 51039]",0.0,-0.2998115269824712,1.5772727272727274,0.0012431038776412606
756,756,363944,3653.52,3656.16, I'll see you in the parking lot,"[51067, 314, 1183, 766, 345, 287, 262, 7647, 1256, 51199]",0.0,-0.2998115269824712,1.5772727272727274,0.0012431038776412606
757,757,363944,3657.52,3659.52, What's the Billy Madison quote?,"[51267, 1867, 338, 262, 15890, 14909, 9577, 30, 51367]",0.0,-0.2998115269824712,1.5772727272727274,0.0012431038776412606
758,758,363944,3660.64,3664.0, Happy Gilmore. That's what it is. Oh the alligator ate his hand,"[51423, 14628, 47169, 13, 1320, 338, 644, 340, 318, 13, 3966, 262, 477, 23823, 15063, 465, 1021, 51591]",0.0,-0.2998115269824712,1.5772727272727274,0.0012431038776412606
759,759,363944,3665.52,3668.0, Carl wethers it's fucking crazy,"[51667, 8124, 266, 6750, 82, 340, 338, 9372, 7165, 51791]",0.0,-0.2998115269824712,1.5772727272727274,0.0012431038776412606
760,760,366800,3668.24,3673.84, Crazy is that you're out there living in Florida. You live with monsters. That's a real legit dinosaur,"[50375, 19932, 318, 326, 345, 821, 503, 612, 2877, 287, 4744, 13, 921, 2107, 351, 10963, 13, 1320, 338, 257, 1103, 6984, 28257, 50655]",0.0,-0.22335342332428576,1.6768558951965065,0.0015943030593916774
761,761,366800,3673.84,3676.32, You think about it too. It's so interesting to think about,"[50655, 921, 892, 546, 340, 1165, 13, 632, 338, 523, 3499, 284, 892, 546, 50779]",0.0,-0.22335342332428576,1.6768558951965065,0.0015943030593916774
762,762,366800,3677.36,3679.36, like even in Florida,"[50831, 588, 772, 287, 4744, 50931]",0.0,-0.22335342332428576,1.6768558951965065,0.0015943030593916774
763,763,366800,3679.52,3681.52, but in Australia,"[50939, 475, 287, 4505, 51039]",0.0,-0.22335342332428576,1.6768558951965065,0.0015943030593916774
764,764,366800,3682.48,3684.48, The spiders,"[51087, 383, 26120, 51187]",0.0,-0.22335342332428576,1.6768558951965065,0.0015943030593916774
765,765,366800,3684.64,3689.84," The house spiders like I see a spider. He's like this big. I'm like, okay, fine","[51195, 383, 2156, 26120, 588, 314, 766, 257, 19230, 13, 679, 338, 588, 428, 1263, 13, 314, 1101, 588, 11, 8788, 11, 3734, 51455]",0.0,-0.22335342332428576,1.6768558951965065,0.0015943030593916774
766,766,366800,3691.76,3696.64," In Australia the average spiders like this fucking big. Yeah, they're what are you gonna do?","[51551, 554, 4505, 262, 2811, 26120, 588, 428, 9372, 1263, 13, 9425, 11, 484, 821, 644, 389, 345, 8066, 466, 30, 51795]",0.0,-0.22335342332428576,1.6768558951965065,0.0015943030593916774
767,767,369664,3696.7999999999997,3700.56, Terrifying creatures over there. There's brown snakes and shit,"[50371, 38859, 4035, 8109, 625, 612, 13, 1318, 338, 7586, 26042, 290, 7510, 50559]",0.0,-0.2126445934690278,1.6796875,0.0010460593039169908
768,768,369664,3701.3599999999997,3706.24, My Australian friend Adam green trees always trying to get me to go out there and go camping with him like get the fuck out of here,"[50599, 2011, 6638, 1545, 7244, 4077, 7150, 1464, 2111, 284, 651, 502, 284, 467, 503, 612, 290, 467, 22498, 351, 683, 588, 651, 262, 5089, 503, 286, 994, 50843]",0.0,-0.2126445934690278,1.6796875,0.0010460593039169908
769,769,369664,3706.3199999999997,3710.56," No, he goes hunting. I'm Australia. Look at that thing","[50847, 1400, 11, 339, 2925, 10988, 13, 314, 1101, 4505, 13, 6803, 379, 326, 1517, 51059]",0.0,-0.2126445934690278,1.6796875,0.0010460593039169908
770,770,369664,3712.0,3718.8799999999997," No, what the fuck? No, no, no, so much protein. If yeah, if you're hungry. Is that a huntsman? Yeah","[51131, 1400, 11, 644, 262, 5089, 30, 1400, 11, 645, 11, 645, 11, 523, 881, 7532, 13, 1002, 10194, 11, 611, 345, 821, 14720, 13, 1148, 326, 257, 42984, 805, 30, 9425, 51475]",0.0,-0.2126445934690278,1.6796875,0.0010460593039169908
771,771,369664,3719.2799999999997,3724.08," Jesus Christ. Look at that thing. That's so big. Australia's just buck wild, man","[51495, 5803, 1951, 13, 6803, 379, 326, 1517, 13, 1320, 338, 523, 1263, 13, 4505, 338, 655, 10230, 4295, 11, 582, 51735]",0.0,-0.2126445934690278,1.6796875,0.0010460593039169908
772,772,372408,3724.88,3731.44, There's it's so bizarre to think like all and you've seen the there's big-ass grasshoppers,"[50403, 1318, 338, 340, 338, 523, 13699, 284, 892, 588, 477, 290, 345, 1053, 1775, 262, 612, 338, 1263, 12, 562, 8701, 8873, 11799, 50731]",0.0,-0.18204947312672934,1.5809523809523809,0.00021215681044850498
773,773,372408,3732.72,3734.72, That are like this big,"[50795, 1320, 389, 588, 428, 1263, 50895]",0.0,-0.18204947312672934,1.5809523809523809,0.00021215681044850498
774,774,372408,3735.84,3737.7599999999998, Locust man,"[50951, 15181, 436, 582, 51047]",0.0,-0.18204947312672934,1.5809523809523809,0.00021215681044850498
775,775,372408,3737.7599999999998,3744.4," Terrifying, you know, I didn't find out until a few years ago. Yeah, look at that fucker. What is that dude?","[51047, 38859, 4035, 11, 345, 760, 11, 314, 1422, 470, 1064, 503, 1566, 257, 1178, 812, 2084, 13, 9425, 11, 804, 379, 326, 5089, 263, 13, 1867, 318, 326, 18396, 30, 51379]",0.0,-0.18204947312672934,1.5809523809523809,0.00021215681044850498
776,776,372408,3745.04,3748.64, He's eating a full carrot like a infant like a toddler,"[51411, 679, 338, 6600, 257, 1336, 40562, 588, 257, 11212, 588, 257, 30773, 51591]",0.0,-0.18204947312672934,1.5809523809523809,0.00021215681044850498
777,777,372408,3749.2,3751.7599999999998, He's eating a carrot like a fucking toddler,"[51619, 679, 338, 6600, 257, 40562, 588, 257, 9372, 30773, 51747]",0.0,-0.18204947312672934,1.5809523809523809,0.00021215681044850498
778,778,375176,3752.4,3757.84," That's insane. It's like he's screaming through a traffic cone. Also if I saw a centipede, I would die","[50395, 1320, 338, 13251, 13, 632, 338, 588, 339, 338, 14788, 832, 257, 4979, 27763, 13, 4418, 611, 314, 2497, 257, 1247, 541, 18654, 11, 314, 561, 4656, 50667]",0.0,-0.2408389002084732,1.7290076335877862,0.00017969841428566724
779,779,375176,3758.0800000000004,3760.0800000000004, Oh my god. Look at the size of that,"[50679, 3966, 616, 5770, 13, 6803, 379, 262, 2546, 286, 326, 50779]",0.0,-0.2408389002084732,1.7290076335877862,0.00017969841428566724
780,780,375176,3760.48,3762.48, Look at that butterfly thing,"[50799, 6803, 379, 326, 35113, 1517, 50899]",0.0,-0.2408389002084732,1.7290076335877862,0.00017969841428566724
781,781,375176,3763.44,3764.32, Moth,"[50947, 337, 849, 50991]",0.0,-0.2408389002084732,1.7290076335877862,0.00017969841428566724
782,782,375176,3764.32,3767.84, Moth's like the ugly butterflies. It's true. It's really the same thing,"[50991, 337, 849, 338, 588, 262, 13400, 44571, 13, 632, 338, 2081, 13, 632, 338, 1107, 262, 976, 1517, 51167]",0.0,-0.2408389002084732,1.7290076335877862,0.00017969841428566724
783,783,375176,3767.84,3771.6800000000003, How come why is that pretty and what is that fucking SWAT every chance?,"[51167, 1374, 1282, 1521, 318, 326, 2495, 290, 644, 318, 326, 9372, 36272, 790, 2863, 30, 51359]",0.0,-0.2408389002084732,1.7290076335877862,0.00017969841428566724
784,784,375176,3772.32,3774.6400000000003, What because we value beauty look at that,"[51391, 1867, 780, 356, 1988, 8737, 804, 379, 326, 51507]",0.0,-0.2408389002084732,1.7290076335877862,0.00017969841428566724
785,785,375176,3775.28,3780.7200000000003, Look at that creepy if I saw that I would run away bro. You ever seen a centipede eat a mouse?,"[51539, 6803, 379, 326, 23387, 611, 314, 2497, 326, 314, 561, 1057, 1497, 1379, 13, 921, 1683, 1775, 257, 1247, 541, 18654, 4483, 257, 10211, 30, 51811]",0.0,-0.2408389002084732,1.7290076335877862,0.00017969841428566724
786,786,378072,3781.12,3783.12," No, do you want to it's probably","[50383, 1400, 11, 466, 345, 765, 284, 340, 338, 2192, 50483]",0.0,-0.19484313448568932,1.7067669172932332,0.0009059754665941
787,787,378072,3784.0,3787.4399999999996, See find a centipede eats a mouse. I didn't know they did this man,"[50527, 4091, 1064, 257, 1247, 541, 18654, 25365, 257, 10211, 13, 314, 1422, 470, 760, 484, 750, 428, 582, 50699]",0.0,-0.19484313448568932,1.7067669172932332,0.0009059754665941
788,788,378072,3787.8399999999997,3792.8799999999997, I see that thing. I never would have thought that thing was a monster. I thought it was just a bug probably,"[50719, 314, 766, 326, 1517, 13, 314, 1239, 561, 423, 1807, 326, 1517, 373, 257, 9234, 13, 314, 1807, 340, 373, 655, 257, 5434, 2192, 50971]",0.0,-0.19484313448568932,1.7067669172932332,0.0009059754665941
789,789,378072,3793.52,3798.24, It's little bugs. Uh-uh. No eats a bounce. You just saw a grasshopper eat a carrot,"[51003, 632, 338, 1310, 11316, 13, 28574, 12, 7456, 13, 1400, 25365, 257, 20110, 13, 921, 655, 2497, 257, 8701, 8873, 2848, 4483, 257, 40562, 51239]",0.0,-0.19484313448568932,1.7067669172932332,0.0009059754665941
790,790,378072,3798.72,3803.4399999999996, Like a fucking four-year-old. It's crazy. That's a four-pound grasshopper,"[51263, 4525, 257, 9372, 1440, 12, 1941, 12, 727, 13, 632, 338, 7165, 13, 1320, 338, 257, 1440, 12, 19568, 8701, 8873, 2848, 51499]",0.0,-0.19484313448568932,1.7067669172932332,0.0009059754665941
791,791,378072,3804.72,3809.12," Look at this. Look at this centipede attacking his mouse. No shit, bro. They're predatory","[51563, 6803, 379, 428, 13, 6803, 379, 428, 1247, 541, 18654, 9274, 465, 10211, 13, 1400, 7510, 11, 1379, 13, 1119, 821, 35341, 51783]",0.0,-0.19484313448568932,1.7067669172932332,0.0009059754665941
792,792,380912,3809.6,3814.0, Like alien like a movie. That's like the movie alien. Holy shit,"[50387, 4525, 8756, 588, 257, 3807, 13, 1320, 338, 588, 262, 3807, 8756, 13, 7439, 7510, 50607]",0.0,-0.28760846455891925,1.7257383966244726,0.0001381654292345047
793,793,380912,3814.08,3821.12, It's biting into the back of the side of the mouth and killing it dude. It's more than sad. That's an alien,"[50611, 632, 338, 30791, 656, 262, 736, 286, 262, 1735, 286, 262, 5422, 290, 5170, 340, 18396, 13, 632, 338, 517, 621, 6507, 13, 1320, 338, 281, 8756, 50963]",0.0,-0.28760846455891925,1.7257383966244726,0.0001381654292345047
794,794,380912,3821.52,3828.72, We're sad. It's it's I can't look at his body. Oh my god. Take that off of the camera. Oh,"[50983, 775, 821, 6507, 13, 632, 338, 340, 338, 314, 460, 470, 804, 379, 465, 1767, 13, 3966, 616, 5770, 13, 7214, 326, 572, 286, 262, 4676, 13, 3966, 51343]",0.0,-0.28760846455891925,1.7257383966244726,0.0001381654292345047
795,795,380912,3829.6,3831.6, That's why you need to learn jujitsu,"[51387, 1320, 338, 1521, 345, 761, 284, 2193, 7544, 73, 19831, 51487]",0.0,-0.28760846455891925,1.7257383966244726,0.0001381654292345047
796,796,380912,3832.64,3838.24, For a centipede might need to learn jujitsu. You need to figure out how to well. That's your next venture move,"[51539, 1114, 257, 1247, 541, 18654, 1244, 761, 284, 2193, 7544, 73, 19831, 13, 921, 761, 284, 3785, 503, 703, 284, 880, 13, 1320, 338, 534, 1306, 13189, 1445, 51819]",0.0,-0.28760846455891925,1.7257383966244726,0.0001381654292345047
797,797,383824,3838.4799999999996,3841.4399999999996, A mice jujitsu class don't let them get your back,"[50375, 317, 10693, 7544, 73, 19831, 1398, 836, 470, 1309, 606, 651, 534, 736, 50523]",0.0,-0.19272180037064987,1.763157894736842,0.000546086928807199
798,798,383824,3842.16,3847.9199999999996, But that's not good. My cat's killed two mice in my your cats are murderers every cats murder,"[50559, 887, 326, 338, 407, 922, 13, 2011, 3797, 338, 2923, 734, 10693, 287, 616, 534, 11875, 389, 38313, 790, 11875, 5123, 50847]",0.0,-0.19272180037064987,1.763157894736842,0.000546086928807199
799,799,383824,3848.24,3849.3599999999997, There's no doubt about that,"[50863, 1318, 338, 645, 4719, 546, 326, 50919]",0.0,-0.19272180037064987,1.763157894736842,0.000546086928807199
800,800,383824,3849.3599999999997,3856.08," But if if the mice knew jujitsu, maybe my cat would have died cat is so big cat is big","[50919, 887, 611, 611, 262, 10693, 2993, 7544, 73, 19831, 11, 3863, 616, 3797, 561, 423, 3724, 3797, 318, 523, 1263, 3797, 318, 1263, 51255]",0.0,-0.19272180037064987,1.763157894736842,0.000546086928807199
801,801,383824,3857.04,3860.3199999999997, They don't have a chance but the centipede's not that much bigger than the mouse,"[51303, 1119, 836, 470, 423, 257, 2863, 475, 262, 1247, 541, 18654, 338, 407, 326, 881, 5749, 621, 262, 10211, 51467]",0.0,-0.19272180037064987,1.763157894736842,0.000546086928807199
802,802,383824,3860.72,3864.3999999999996, Or it's smaller than the mouse really cat is big mice is small,"[51487, 1471, 340, 338, 4833, 621, 262, 10211, 1107, 3797, 318, 1263, 10693, 318, 1402, 51671]",0.0,-0.19272180037064987,1.763157894736842,0.000546086928807199
803,803,386440,3864.96,3867.92," Well, we got to worry about his bugs because bugs are small","[50391, 3894, 11, 356, 1392, 284, 5490, 546, 465, 11316, 780, 11316, 389, 1402, 50539]",0.0,-0.23340274169381742,1.6394052044609666,0.0003069259109906852
804,804,386440,3868.4,3870.7200000000003, But that's what nature did to them. They made them like,"[50563, 887, 326, 338, 644, 3450, 750, 284, 606, 13, 1119, 925, 606, 588, 50679]",0.0,-0.23340274169381742,1.6394052044609666,0.0003069259109906852
805,805,386440,3871.36,3876.8, Invulnerable but small so we could squash them. But if they were big we'd be so fucked,"[50711, 10001, 38828, 475, 1402, 523, 356, 714, 34613, 606, 13, 887, 611, 484, 547, 1263, 356, 1549, 307, 523, 20654, 50983]",0.0,-0.23340274169381742,1.6394052044609666,0.0003069259109906852
806,806,386440,3877.44,3879.84, Those murder hornets remember they were trying to scare us with those,"[51015, 5845, 5123, 12718, 1039, 3505, 484, 547, 2111, 284, 19437, 514, 351, 883, 51135]",0.0,-0.23340274169381742,1.6394052044609666,0.0003069259109906852
807,807,386440,3881.36,3883.28," Yeah, that was it was right during the covid","[51211, 9425, 11, 326, 373, 340, 373, 826, 1141, 262, 39849, 312, 51307]",0.0,-0.23340274169381742,1.6394052044609666,0.0003069259109906852
808,808,386440,3883.6,3887.44," Like you know, you saw tiger king and then murder haunted but then no","[51323, 4525, 345, 760, 11, 345, 2497, 26241, 5822, 290, 788, 5123, 26688, 475, 788, 645, 51515]",0.0,-0.23340274169381742,1.6394052044609666,0.0003069259109906852
809,809,386440,3887.44,3891.12, But then the honeybee figured out how to vibrate yeah,"[51515, 887, 788, 262, 12498, 20963, 11638, 503, 703, 284, 12611, 378, 10194, 51699]",0.0,-0.23340274169381742,1.6394052044609666,0.0003069259109906852
810,810,389112,3891.44,3895.44, All around it and kill it with heat isn't that crazy? That's crazy,"[50379, 1439, 1088, 340, 290, 1494, 340, 351, 4894, 2125, 470, 326, 7165, 30, 1320, 338, 7165, 50579]",0.0,-0.20605657854650775,1.790983606557377,0.0005176363629288971
811,811,389112,3896.0,3897.8399999999997, It's crazy. How do they figure that out?,"[50607, 632, 338, 7165, 13, 1374, 466, 484, 3785, 326, 503, 30, 50699]",0.0,-0.20605657854650775,1.790983606557377,0.0005176363629288971
812,812,389112,3897.8399999999997,3901.2799999999997, And how do they know how to work together to overheat the the well?,"[50699, 843, 703, 466, 484, 760, 703, 284, 670, 1978, 284, 625, 25080, 262, 262, 880, 30, 50871]",0.0,-0.20605657854650775,1.790983606557377,0.0005176363629288971
813,813,389112,3901.44,3903.7599999999998, Utah is the hive state murder wasp,"[50879, 10202, 318, 262, 35881, 1181, 5123, 373, 79, 50995]",0.0,-0.20605657854650775,1.790983606557377,0.0005176363629288971
814,814,389112,3904.3199999999997,3908.4, Utah is the hive state so bees are smart as shit. Yeah,"[51023, 10202, 318, 262, 35881, 1181, 523, 17002, 389, 4451, 355, 7510, 13, 9425, 51227]",0.0,-0.20605657854650775,1.790983606557377,0.0005176363629288971
815,815,389112,3909.12,3914.16, They're weirdly smart weirdly smart. There's something connected to bees and,"[51263, 1119, 821, 7650, 306, 4451, 7650, 306, 4451, 13, 1318, 338, 1223, 5884, 284, 17002, 290, 51515]",0.0,-0.20605657854650775,1.790983606557377,0.0005176363629288971
816,816,389112,3915.2799999999997,3920.4, Aliens well for sure. How come they all know how to make that fucking hive? There's no classes,"[51571, 39301, 880, 329, 1654, 13, 1374, 1282, 484, 477, 760, 703, 284, 787, 326, 9372, 35881, 30, 1318, 338, 645, 6097, 51827]",0.0,-0.20605657854650775,1.790983606557377,0.0005176363629288971
817,817,392040,3921.36,3926.2400000000002, It's just come out no one like let's go come on man imagine all over the world,"[50411, 632, 338, 655, 1282, 503, 645, 530, 588, 1309, 338, 467, 1282, 319, 582, 5967, 477, 625, 262, 995, 50655]",0.0,-0.2480036980282944,1.7787610619469028,0.00198725494556129
818,818,392040,3926.64,3930.32, This one being knows exactly the kind of shape to make,"[50675, 770, 530, 852, 4206, 3446, 262, 1611, 286, 5485, 284, 787, 50859]",0.0,-0.2480036980282944,1.7787610619469028,0.00198725494556129
819,819,392040,3930.96,3933.36, And makes it with like what's it using?,"[50891, 843, 1838, 340, 351, 588, 644, 338, 340, 1262, 30, 51011]",0.0,-0.2480036980282944,1.7787610619469028,0.00198725494556129
820,820,392040,3933.84,3935.84, How do what it creates that wax?,"[51035, 1374, 466, 644, 340, 8075, 326, 20302, 30, 51135]",0.0,-0.2480036980282944,1.7787610619469028,0.00198725494556129
821,821,392040,3936.4,3938.2400000000002, It's like it's using what they get,"[51163, 632, 338, 588, 340, 338, 1262, 644, 484, 651, 51255]",0.0,-0.2480036980282944,1.7787610619469028,0.00198725494556129
822,822,392040,3939.2000000000003,3941.6800000000003," It's using what they get from plants, right?","[51303, 632, 338, 1262, 644, 484, 651, 422, 6134, 11, 826, 30, 51427]",0.0,-0.2480036980282944,1.7787610619469028,0.00198725494556129
823,823,392040,3942.32,3945.76, Is it pollen that makes the stuff that they use for wax?,"[51459, 1148, 340, 40362, 326, 1838, 262, 3404, 326, 484, 779, 329, 20302, 30, 51631]",0.0,-0.2480036980282944,1.7787610619469028,0.00198725494556129
824,824,392040,3946.08,3948.88, Is that what they get or is it an excretion from their own,"[51647, 1148, 326, 644, 484, 651, 393, 318, 340, 281, 2859, 12307, 422, 511, 898, 51787]",0.0,-0.2480036980282944,1.7787610619469028,0.00198725494556129
825,825,394888,3949.2000000000003,3956.4, Ex- excretion so they eat then they make this excretion and then they literally build a house with their own spit and then we eat it,"[50379, 1475, 12, 2859, 12307, 523, 484, 4483, 788, 484, 787, 428, 2859, 12307, 290, 788, 484, 7360, 1382, 257, 2156, 351, 511, 898, 27591, 290, 788, 356, 4483, 340, 50739]",0.0,-0.25671357928581956,1.6635514018691588,0.0014022922841832042
826,826,394888,3957.04,3960.08," Yeah, it's delicious. Honeycomb. It's very good","[50771, 9425, 11, 340, 338, 12625, 13, 21788, 24011, 13, 632, 338, 845, 922, 50923]",0.0,-0.25671357928581956,1.6635514018691588,0.0014022922841832042
827,827,394888,3961.44,3964.1600000000003, Never had it. I'm not a big honey guy. No,"[50991, 7236, 550, 340, 13, 314, 1101, 407, 257, 1263, 12498, 3516, 13, 1400, 51127]",0.0,-0.25671357928581956,1.6635514018691588,0.0014022922841832042
828,828,394888,3965.2000000000003,3967.2000000000003, Are you into sweet and low?,"[51179, 4231, 345, 656, 6029, 290, 1877, 30, 51279]",0.0,-0.25671357928581956,1.6635514018691588,0.0014022922841832042
829,829,394888,3967.28,3968.8, No,"[51283, 1400, 51359]",0.0,-0.25671357928581956,1.6635514018691588,0.0014022922841832042
830,830,394888,3968.8,3971.12, You you're an aspartame or a real sugar guy,"[51359, 921, 345, 821, 281, 355, 3911, 480, 393, 257, 1103, 7543, 3516, 51475]",0.0,-0.25671357928581956,1.6635514018691588,0.0014022922841832042
831,831,394888,3972.6400000000003,3975.52, I like the coke with real sugar real sugar coke's the best,"[51551, 314, 588, 262, 763, 365, 351, 1103, 7543, 1103, 7543, 763, 365, 338, 262, 1266, 51695]",0.0,-0.25671357928581956,1.6635514018691588,0.0014022922841832042
832,832,397552,3976.08,3979.36, It's true and there's an added benefit of knowing it's killing your body,"[50391, 632, 338, 2081, 290, 612, 338, 281, 2087, 4414, 286, 6970, 340, 338, 5170, 534, 1767, 50555]",0.0,-0.2887098378148572,1.6363636363636365,0.0006379537517204881
833,833,397552,3980.24,3984.96, The diet coke you could pretend you're healthy. I'm having a diet coke. This is basically like a,"[50599, 383, 5496, 763, 365, 345, 714, 16614, 345, 821, 5448, 13, 314, 1101, 1719, 257, 5496, 763, 365, 13, 770, 318, 6209, 588, 257, 50835]",0.0,-0.2887098378148572,1.6363636363636365,0.0006379537517204881
834,834,397552,3984.96,3986.56, Max,"[50835, 5436, 50915]",0.0,-0.2887098378148572,1.6363636363636365,0.0006379537517204881
835,835,397552,3986.56,3992.24, That is not water bitch. That doesn't there's nothing about that. That's water. This is water for me,"[50915, 1320, 318, 407, 1660, 21551, 13, 1320, 1595, 470, 612, 338, 2147, 546, 326, 13, 1320, 338, 1660, 13, 770, 318, 1660, 329, 502, 51199]",0.0,-0.2887098378148572,1.6363636363636365,0.0006379537517204881
836,836,397552,3993.52,3995.52, You know,"[51263, 921, 760, 51363]",0.0,-0.2887098378148572,1.6363636363636365,0.0006379537517204881
837,837,397552,3995.52,3996.72, Say,"[51363, 13816, 51423]",0.0,-0.2887098378148572,1.6363636363636365,0.0006379537517204881
838,838,397552,3996.72,4000.72, Why don't you crack that one open? I will I will let's really get into it,"[51423, 4162, 836, 470, 345, 8469, 326, 530, 1280, 30, 314, 481, 314, 481, 1309, 338, 1107, 651, 656, 340, 51623]",0.0,-0.2887098378148572,1.6363636363636365,0.0006379537517204881
