,id,seek,start,end,text,tokens,temperature,avg_logprob,compression_ratio,no_speech_prob
2295,2295,1036640,10387.359999999999,10391.44, Exactly. So when do you when's that call get made? That's what's complicated about it,"[51411, 36819, 13, 1406, 618, 466, 345, 618, 338, 326, 869, 651, 925, 30, 1320, 338, 644, 338, 8253, 546, 340, 51615]",0.0,-0.18878331315626792,1.75,0.00024614817812107503
2296,2296,1039144,10391.44,10395.76, And that's what no one from either this is like one of the most truly human problems,"[50363, 843, 326, 338, 644, 645, 530, 422, 2035, 428, 318, 588, 530, 286, 262, 749, 4988, 1692, 2761, 50579]",0.0,-0.11762094497680664,1.7598566308243728,0.0035244727041572332
2297,2297,1039144,10395.76,10400.800000000001, We've ever faced because no one really knows what the right thing to do is there'll be a lot of armchair,"[50579, 775, 1053, 1683, 7452, 780, 645, 530, 1107, 4206, 644, 262, 826, 1517, 284, 466, 318, 612, 1183, 307, 257, 1256, 286, 3211, 16337, 50831]",0.0,-0.11762094497680664,1.7598566308243728,0.0035244727041572332
2298,2298,1039144,10401.04,10403.04, Quarterbacking after it's over where people who,"[50843, 17264, 1891, 278, 706, 340, 338, 625, 810, 661, 508, 50943]",0.0,-0.11762094497680664,1.7598566308243728,0.0035244727041572332
2299,2299,1039144,10403.76,10405.76, You know people die,"[50979, 921, 760, 661, 4656, 51079]",0.0,-0.11762094497680664,1.7598566308243728,0.0035244727041572332
2300,2300,1039144,10405.76,10409.36," People who look back on and say they should have done this or they should have done that well, that's great","[51079, 4380, 508, 804, 736, 319, 290, 910, 484, 815, 423, 1760, 428, 393, 484, 815, 423, 1760, 326, 880, 11, 326, 338, 1049, 51259]",0.0,-0.11762094497680664,1.7598566308243728,0.0035244727041572332
2301,2301,1039144,10410.0,10414.960000000001," And maybe maybe some people had a better idea of how to handle it, but it's just guessing","[51291, 843, 3863, 3863, 617, 661, 550, 257, 1365, 2126, 286, 703, 284, 5412, 340, 11, 475, 340, 338, 655, 25260, 51539]",0.0,-0.11762094497680664,1.7598566308243728,0.0035244727041572332
2302,2302,1039144,10416.16,10418.16, Right now. It's just guessing. Yeah,"[51599, 6498, 783, 13, 632, 338, 655, 25260, 13, 9425, 51699]",0.0,-0.11762094497680664,1.7598566308243728,0.0035244727041572332
2303,2303,1041816,10418.72,10420.56, It's fucking weird dude,"[50391, 632, 338, 9372, 7650, 18396, 50483]",0.0,-0.13533154882565893,1.6285714285714286,0.00014827465929556638
2304,2304,1041816,10420.56,10423.039999999999, it's weird to me that there is a,"[50483, 340, 338, 7650, 284, 502, 326, 612, 318, 257, 50607]",0.0,-0.13533154882565893,1.6285714285714286,0.00014827465929556638
2305,2305,1041816,10424.24,10428.4, It's like me in school having to fucking tuck in my shirt,"[50667, 632, 338, 588, 502, 287, 1524, 1719, 284, 9372, 256, 1347, 287, 616, 10147, 50875]",0.0,-0.13533154882565893,1.6285714285714286,0.00014827465929556638
2306,2306,1041816,10430.0,10434.0, Or else you get detention or whatever. It's weird to be,"[50955, 1471, 2073, 345, 651, 13280, 393, 4232, 13, 632, 338, 7650, 284, 307, 51155]",0.0,-0.13533154882565893,1.6285714285714286,0.00014827465929556638
2307,2307,1041816,10436.72,10438.72, Forced to wear something,"[51291, 40731, 284, 5806, 1223, 51391]",0.0,-0.13533154882565893,1.6285714285714286,0.00014827465929556638
2308,2308,1041816,10439.52,10443.6," Right. So that's what you feel about the mask. I see what you're saying. Yeah, but you know that it does work, right?","[51431, 6498, 13, 1406, 326, 338, 644, 345, 1254, 546, 262, 9335, 13, 314, 766, 644, 345, 821, 2282, 13, 9425, 11, 475, 345, 760, 326, 340, 857, 670, 11, 826, 30, 51635]",0.0,-0.13533154882565893,1.6285714285714286,0.00014827465929556638
2309,2309,1041816,10443.6,10445.2, That's what's weird about it,"[51635, 1320, 338, 644, 338, 7650, 546, 340, 51715]",0.0,-0.13533154882565893,1.6285714285714286,0.00014827465929556638
2310,2310,1044520,10445.6,10448.800000000001, If you wear a good mask it actually does prevent a lot of transmission,"[50383, 1002, 345, 5806, 257, 922, 9335, 340, 1682, 857, 2948, 257, 1256, 286, 11478, 50543]",0.0,-0.22754498436337425,1.6666666666666667,0.0013070775894448161
2311,2311,1044520,10448.800000000001,10451.36, Apparently that's all Japan why to say it that way?,"[50543, 18626, 326, 338, 477, 2869, 1521, 284, 910, 340, 326, 835, 30, 50671]",0.0,-0.22754498436337425,1.6666666666666667,0.0013070775894448161
2312,2312,1044520,10451.76,10457.92, Japan that's all Japan. I was in the middle of saying Japan I stumbled through it some weird way necrogoblic,"[50691, 2869, 326, 338, 477, 2869, 13, 314, 373, 287, 262, 3504, 286, 2282, 2869, 314, 24241, 832, 340, 617, 7650, 835, 27576, 3828, 672, 677, 50999]",0.0,-0.22754498436337425,1.6666666666666667,0.0013070775894448161
2313,2313,1044520,10459.84,10461.84, Words are hard. Sorry,"[51095, 23087, 389, 1327, 13, 19061, 51195]",0.0,-0.22754498436337425,1.6666666666666667,0.0013070775894448161
2314,2314,1044520,10462.640000000001,10466.320000000002, Japan they they didn't shut their economy down. They just wore masks,"[51235, 2869, 484, 484, 1422, 470, 4423, 511, 3773, 866, 13, 1119, 655, 12408, 20680, 51419]",0.0,-0.22754498436337425,1.6666666666666667,0.0013070775894448161
2315,2315,1044520,10467.52,10471.76," Well, I mean that's yeah, they didn't suffer that many deaths either. It's really weird","[51479, 3894, 11, 314, 1612, 326, 338, 10194, 11, 484, 1422, 470, 8659, 326, 867, 7040, 2035, 13, 632, 338, 1107, 7650, 51691]",0.0,-0.22754498436337425,1.6666666666666667,0.0013070775894448161
2316,2316,1047176,10472.56,10477.28," The um, I wonder I would like to see like a documentary on how Japan","[50403, 383, 23781, 11, 314, 4240, 314, 561, 588, 284, 766, 588, 257, 11648, 319, 703, 2869, 50639]",0.0,-0.18009568890954694,1.56,0.0011076797964051366
2317,2317,1047176,10478.0,10481.04, Managed covid-19 because they did an insane job,"[50675, 1869, 1886, 39849, 312, 12, 1129, 780, 484, 750, 281, 13251, 1693, 50827]",0.0,-0.18009568890954694,1.56,0.0011076797964051366
2318,2318,1047176,10481.84,10486.48," Maybe as good a job as anybody. Yeah, I think there's only a thousand deaths in all of Japan","[50867, 6674, 355, 922, 257, 1693, 355, 9599, 13, 9425, 11, 314, 892, 612, 338, 691, 257, 7319, 7040, 287, 477, 286, 2869, 51099]",0.0,-0.18009568890954694,1.56,0.0011076797964051366
2319,2319,1047176,10487.12,10491.12, Kyle Kalinsky was telling me about this and he sent me some article if you can't find it,"[51131, 14316, 12612, 19870, 373, 5149, 502, 546, 428, 290, 339, 1908, 502, 617, 2708, 611, 345, 460, 470, 1064, 340, 51331]",0.0,-0.18009568890954694,1.56,0.0011076797964051366
2320,2320,1047176,10491.12,10492.880000000001," I'll send you the article, but it's pretty crazy. It's","[51331, 314, 1183, 3758, 345, 262, 2708, 11, 475, 340, 338, 2495, 7165, 13, 632, 338, 51419]",0.0,-0.18009568890954694,1.56,0.0011076797964051366
2321,2321,1047176,10493.68,10498.64, It's all in how they never shut the economy down. They just saw a warm mask,"[51459, 632, 338, 477, 287, 703, 484, 1239, 4423, 262, 3773, 866, 13, 1119, 655, 2497, 257, 5814, 9335, 51707]",0.0,-0.18009568890954694,1.56,0.0011076797964051366
2322,2322,1049864,10498.96,10501.519999999999, Everybody followed the rules and they contained it,"[50379, 23080, 3940, 262, 3173, 290, 484, 7763, 340, 50507]",0.0,-0.20201088178275836,1.7733990147783252,0.001419674837961793
2323,2323,1049864,10502.24,10507.039999999999, That's the and that's and that no I mean at the end of the day it all comes down to,"[50543, 1320, 338, 262, 290, 326, 338, 290, 326, 645, 314, 1612, 379, 262, 886, 286, 262, 1110, 340, 477, 2058, 866, 284, 50783]",0.0,-0.20201088178275836,1.7733990147783252,0.001419674837961793
2324,2324,1049864,10508.88,10510.88, Respect for other people,"[50875, 42153, 329, 584, 661, 50975]",0.0,-0.20201088178275836,1.7733990147783252,0.001419674837961793
2325,2325,1049864,10511.519999999999,10517.76," Sure, right. That's what a mask is for right. It's right. It's not it's not a government thing. It's not like","[51007, 10889, 11, 826, 13, 1320, 338, 644, 257, 9335, 318, 329, 826, 13, 632, 338, 826, 13, 632, 338, 407, 340, 338, 407, 257, 1230, 1517, 13, 632, 338, 407, 588, 51319]",0.0,-0.20201088178275836,1.7733990147783252,0.001419674837961793
2326,2326,1049864,10520.32,10524.08, You shouldn't you shouldn't be forced to wear a mask,"[51447, 921, 6584, 470, 345, 6584, 470, 307, 4137, 284, 5806, 257, 9335, 51635]",0.0,-0.20201088178275836,1.7733990147783252,0.001419674837961793
2327,2327,1049864,10525.119999999999,10526.64, But you should,"[51687, 887, 345, 815, 51763]",0.0,-0.20201088178275836,1.7733990147783252,0.001419674837961793
2328,2328,1049864,10526.64,10528.4, Wear a mask right. Yes,"[51763, 27539, 257, 9335, 826, 13, 3363, 51851]",0.0,-0.20201088178275836,1.7733990147783252,0.001419674837961793
2329,2329,1052864,10529.039999999999,10535.039999999999," Yeah, you should wear a mask as you're a good person right and that's because I respect you as a fellow human","[50383, 9425, 11, 345, 815, 5806, 257, 9335, 355, 345, 821, 257, 922, 1048, 826, 290, 326, 338, 780, 314, 2461, 345, 355, 257, 5891, 1692, 50683]",0.0,-0.2119670867919922,1.611353711790393,4.842058478971012e-05
2330,2330,1052864,10535.599999999999,10539.279999999999," Yeah, it has nothing to do with being 600 bucks","[50711, 9425, 11, 340, 468, 2147, 284, 466, 351, 852, 10053, 24780, 50895]",0.0,-0.2119670867919922,1.611353711790393,4.842058478971012e-05
2331,2331,1052864,10540.64,10546.72, That's what it cost that some places. It's 600. But I saw what what is it in Beverly Hills right now,"[50963, 1320, 338, 644, 340, 1575, 326, 617, 4113, 13, 632, 338, 10053, 13, 887, 314, 2497, 644, 644, 318, 340, 287, 30633, 14379, 826, 783, 51267]",0.0,-0.2119670867919922,1.611353711790393,4.842058478971012e-05
2332,2332,1052864,10546.72,10551.119999999999, I saw it. Do we have a fine 300 no time no fine for looting?,"[51267, 314, 2497, 340, 13, 2141, 356, 423, 257, 3734, 5867, 645, 640, 645, 3734, 329, 39473, 30, 51487]",0.0,-0.2119670867919922,1.611353711790393,4.842058478971012e-05
2333,2333,1052864,10551.68,10554.4, 300 bucks for not wearing a mask in Beverly Hills,"[51515, 5867, 24780, 329, 407, 5762, 257, 9335, 287, 30633, 14379, 51651]",0.0,-0.2119670867919922,1.611353711790393,4.842058478971012e-05
2334,2334,1055440,10554.4,10557.68, Definitely you should wear a mask just so if people feel better for now,"[50363, 33562, 345, 815, 5806, 257, 9335, 655, 523, 611, 661, 1254, 1365, 329, 783, 50527]",0.0,-0.22935736892569777,1.7545126353790614,0.0011912083718925714
2335,2335,1055440,10558.16,10560.08," I mean we got to get through this together. No, yeah","[50551, 314, 1612, 356, 1392, 284, 651, 832, 428, 1978, 13, 1400, 11, 10194, 50647]",0.0,-0.22935736892569777,1.7545126353790614,0.0011912083718925714
2336,2336,1055440,10560.08,10563.68, But and that's but I don't know about finding people for it and the other thing was snitching,"[50647, 887, 290, 326, 338, 475, 314, 836, 470, 760, 546, 4917, 661, 329, 340, 290, 262, 584, 1517, 373, 3013, 19811, 50827]",0.0,-0.22935736892569777,1.7545126353790614,0.0011912083718925714
2337,2337,1055440,10563.68,10568.24, They were paying people to snitch on people who weren't social distancing. That was the mayor,"[50827, 1119, 547, 5989, 661, 284, 3013, 2007, 319, 661, 508, 6304, 470, 1919, 1233, 5077, 13, 1320, 373, 262, 9591, 51055]",0.0,-0.22935736892569777,1.7545126353790614,0.0011912083718925714
2338,2338,1055440,10568.64,10571.199999999999, Mayor of gao mayor of law s Angeles,"[51075, 10106, 286, 308, 5488, 9591, 286, 1099, 264, 5652, 51203]",0.0,-0.22935736892569777,1.7545126353790614,0.0011912083718925714
2339,2339,1055440,10571.52,10576.24," They they were like ordinarily snitches get stitches, but now snitches get rewards","[51219, 1119, 484, 547, 588, 43605, 3013, 9249, 651, 28096, 11, 475, 783, 3013, 9249, 651, 11530, 51455]",0.0,-0.22935736892569777,1.7545126353790614,0.0011912083718925714
2340,2340,1055440,10576.8,10580.48, They were literally giving people money or advertising,"[51483, 1119, 547, 7360, 3501, 661, 1637, 393, 8560, 51667]",0.0,-0.22935736892569777,1.7545126353790614,0.0011912083718925714
2341,2341,1058048,10580.48,10584.32, I don't know they ever gave any money out advertising. They would give people give away rewards,"[50363, 314, 836, 470, 760, 484, 1683, 2921, 597, 1637, 503, 8560, 13, 1119, 561, 1577, 661, 1577, 1497, 11530, 50555]",0.0,-0.2444165724295157,1.6707818930041152,0.005362590309232473
2342,2342,1058048,10584.8,10587.039999999999, For people who turn in people who are not so,"[50579, 1114, 661, 508, 1210, 287, 661, 508, 389, 407, 523, 50691]",0.0,-0.2444165724295157,1.6707818930041152,0.005362590309232473
2343,2343,1058048,10589.119999999999,10591.68, It's like they why not just say something to the guy,"[50795, 632, 338, 588, 484, 1521, 407, 655, 910, 1223, 284, 262, 3516, 50923]",0.0,-0.2444165724295157,1.6707818930041152,0.005362590309232473
2344,2344,1058048,10594.0,10595.119999999999, Hey,"[51039, 14690, 51095]",0.0,-0.2444165724295157,1.6707818930041152,0.005362590309232473
2345,2345,1058048,10595.119999999999,10599.279999999999, Why not just say hey put your mask on bub no that's too complicated,"[51095, 4162, 407, 655, 910, 17207, 1234, 534, 9335, 319, 10015, 645, 326, 338, 1165, 8253, 51303]",0.0,-0.2444165724295157,1.6707818930041152,0.005362590309232473
2346,2346,1058048,10599.76,10602.96," You're asking too much, but then you have to how long is the rebate?","[51327, 921, 821, 4737, 1165, 881, 11, 475, 788, 345, 423, 284, 703, 890, 318, 262, 49099, 30, 51487]",0.0,-0.2444165724295157,1.6707818930041152,0.005362590309232473
2347,2347,1058048,10603.039999999999,10606.96, Is it like uh like you have to mail in like that's a good question. Yes,"[51491, 1148, 340, 588, 21480, 588, 345, 423, 284, 6920, 287, 588, 326, 338, 257, 922, 1808, 13, 3363, 51687]",0.0,-0.2444165724295157,1.6707818930041152,0.005362590309232473
2348,2348,1060696,10606.96,10608.08, I know,"[50363, 314, 760, 50419]",0.0,-0.22579719081069483,1.553191489361702,0.010364077053964138
2349,2349,1060696,10608.08,10611.839999999998, They still haven't got paid yet. They feel like a fucking terrible person like bro,"[50419, 1119, 991, 4398, 470, 1392, 3432, 1865, 13, 1119, 1254, 588, 257, 9372, 7818, 1048, 588, 1379, 50607]",0.0,-0.22579719081069483,1.553191489361702,0.010364077053964138
2350,2350,1060696,10611.919999999998,10617.839999999998," I turned you in. I need the money to pay my rent. Meanwhile months later, but the money still hasn't come","[50611, 314, 2900, 345, 287, 13, 314, 761, 262, 1637, 284, 1414, 616, 5602, 13, 11214, 1933, 1568, 11, 475, 262, 1637, 991, 5818, 470, 1282, 50907]",0.0,-0.22579719081069483,1.553191489361702,0.010364077053964138
2351,2351,1060696,10619.119999999999,10623.119999999999, If he is rough and I know I slept in a closet,"[50971, 1002, 339, 318, 5210, 290, 314, 760, 314, 21256, 287, 257, 21615, 51171]",0.0,-0.22579719081069483,1.553191489361702,0.010364077053964138
2352,2352,1060696,10624.48,10626.48, $300,"[51239, 720, 6200, 51339]",0.0,-0.22579719081069483,1.553191489361702,0.010364077053964138
2353,2353,1060696,10626.48,10628.48, Because maybe someone,"[51339, 4362, 3863, 2130, 51439]",0.0,-0.22579719081069483,1.553191489361702,0.010364077053964138
2354,2354,1060696,10628.72,10635.839999999998, Sees you eating and you don't have a mask on and then you were stuck with a fucking ticket. Yeah,"[51451, 1001, 274, 345, 6600, 290, 345, 836, 470, 423, 257, 9335, 319, 290, 788, 345, 547, 7819, 351, 257, 9372, 7846, 13, 9425, 51807]",0.0,-0.22579719081069483,1.553191489361702,0.010364077053964138
2355,2355,1063696,10637.359999999999,10639.359999999999, That it blows my mind. It's weird,"[50383, 1320, 340, 20385, 616, 2000, 13, 632, 338, 7650, 50483]",0.0,-0.20726228729496157,1.6541353383458646,0.00018119179003406316
2356,2356,1063696,10639.439999999999,10645.439999999999, It's all about fucking the responsibility of and your character really if you snitch,"[50487, 632, 338, 477, 546, 9372, 262, 5798, 286, 290, 534, 2095, 1107, 611, 345, 3013, 2007, 50787]",0.0,-0.20726228729496157,1.6541353383458646,0.00018119179003406316
2357,2357,1063696,10646.0,10648.64, And they don't pay you what do you do?,"[50815, 843, 484, 836, 470, 1414, 345, 644, 466, 345, 466, 30, 50947]",0.0,-0.20726228729496157,1.6541353383458646,0.00018119179003406316
2358,2358,1063696,10649.199999999999,10651.599999999999, Who's gonna who's gonna want to hear you wine?,"[50975, 5338, 338, 8066, 508, 338, 8066, 765, 284, 3285, 345, 8237, 30, 51095]",0.0,-0.20726228729496157,1.6541353383458646,0.00018119179003406316
2359,2359,1063696,10652.32,10658.0," If you snitch like hey, I uh I turned in with this family next door. They were having a picnic and uh,","[51131, 1002, 345, 3013, 2007, 588, 17207, 11, 314, 21480, 314, 2900, 287, 351, 428, 1641, 1306, 3420, 13, 1119, 547, 1719, 257, 35715, 290, 21480, 11, 51415]",0.0,-0.20726228729496157,1.6541353383458646,0.00018119179003406316
2360,2360,1063696,10658.0,10662.48, I never got my reward. I don't even know how that works. How about lost dogs?,"[51415, 314, 1239, 1392, 616, 6721, 13, 314, 836, 470, 772, 760, 703, 326, 2499, 13, 1374, 546, 2626, 6844, 30, 51639]",0.0,-0.20726228729496157,1.6541353383458646,0.00018119179003406316
2361,2361,1063696,10663.199999999999,10666.08, Do they ever pay the cash amount? They never pay them?,"[51675, 2141, 484, 1683, 1414, 262, 5003, 2033, 30, 1119, 1239, 1414, 606, 30, 51819]",0.0,-0.20726228729496157,1.6541353383458646,0.00018119179003406316
2362,2362,1066608,10666.56,10671.84," They want them. They never find them lost dogs. No, this is christ. That's dark. They're coyote food","[50387, 1119, 765, 606, 13, 1119, 1239, 1064, 606, 2626, 6844, 13, 1400, 11, 428, 318, 33826, 13, 1320, 338, 3223, 13, 1119, 821, 34003, 1258, 2057, 50651]",0.0,-0.2530486443463494,1.7672727272727273,0.0003158741455990821
2363,2363,1066608,10672.32,10674.48, Most of the time in LA. That's true,"[50675, 4042, 286, 262, 640, 287, 9131, 13, 1320, 338, 2081, 50783]",0.0,-0.2530486443463494,1.7672727272727273,0.0003158741455990821
2364,2364,1066608,10675.039999999999,10679.12, When I drive through my neighborhood and I see like a poodle on a sign. I just make the sign of the cross,"[50811, 1649, 314, 3708, 832, 616, 6232, 290, 314, 766, 588, 257, 279, 27106, 319, 257, 1051, 13, 314, 655, 787, 262, 1051, 286, 262, 3272, 51015]",0.0,-0.2530486443463494,1.7672727272727273,0.0003158741455990821
2365,2365,1066608,10679.68,10681.52," That's it, baby","[51043, 1320, 338, 340, 11, 5156, 51135]",0.0,-0.2530486443463494,1.7672727272727273,0.0003158741455990821
2366,2366,1066608,10681.52,10683.12, You don't even try,"[51135, 921, 836, 470, 772, 1949, 51215]",0.0,-0.2530486443463494,1.7672727272727273,0.0003158741455990821
2367,2367,1066608,10683.12,10687.039999999999, You're you're not even see it and you're like poodles gone. Gotta keep my eyes peeled,"[51215, 921, 821, 345, 821, 407, 772, 766, 340, 290, 345, 821, 588, 279, 702, 829, 3750, 13, 402, 12375, 1394, 616, 2951, 42617, 51411]",0.0,-0.2530486443463494,1.7672727272727273,0.0003158741455990821
2368,2368,1066608,10687.039999999999,10692.48, You don't understand how many coyotes are on my neighborhood. I've lost 19 chickens. I lost 19 chickens in my neighborhood,"[51411, 921, 836, 470, 1833, 703, 867, 34003, 6421, 389, 319, 616, 6232, 13, 314, 1053, 2626, 678, 25972, 13, 314, 2626, 678, 25972, 287, 616, 6232, 51683]",0.0,-0.2530486443463494,1.7672727272727273,0.0003158741455990821
2369,2369,1069248,10693.359999999999,10699.6, I'll hear coyotes. I'm fucking rough. Dude. We lost them one at a time these motherfuckers,"[50407, 314, 1183, 3285, 34003, 6421, 13, 314, 1101, 9372, 5210, 13, 40628, 13, 775, 2626, 606, 530, 379, 257, 640, 777, 2802, 31699, 364, 50719]",0.0,-0.18652693149262825,1.696,0.0021262953523546457
2370,2370,1069248,10699.6,10704.96, And then the the last I guess we had like 11 of them left after the fire,"[50719, 843, 788, 262, 262, 938, 314, 4724, 356, 550, 588, 1367, 286, 606, 1364, 706, 262, 2046, 50987]",0.0,-0.18652693149262825,1.696,0.0021262953523546457
2371,2371,1069248,10705.92,10707.76, After the big fires out here,"[51035, 2293, 262, 1263, 12252, 503, 994, 51127]",0.0,-0.18652693149262825,1.696,0.0021262953523546457
2372,2372,1069248,10707.76,10711.439999999999," We had uh they burned down the chicken coop, but they were still alive and there was like","[51127, 775, 550, 21480, 484, 11544, 866, 262, 9015, 763, 404, 11, 475, 484, 547, 991, 6776, 290, 612, 373, 588, 51311]",0.0,-0.18652693149262825,1.696,0.0021262953523546457
2373,2373,1069248,10711.92,10713.279999999999, I think 11 of them on left,"[51335, 314, 892, 1367, 286, 606, 319, 1364, 51403]",0.0,-0.18652693149262825,1.696,0.0021262953523546457
2374,2374,1069248,10713.279999999999,10718.0, They put them in a smaller chicken coop while we had the other one reconstructed and one day the coyotes got to it,"[51403, 1119, 1234, 606, 287, 257, 4833, 9015, 763, 404, 981, 356, 550, 262, 584, 530, 49594, 290, 530, 1110, 262, 34003, 6421, 1392, 284, 340, 51639]",0.0,-0.18652693149262825,1.696,0.0021262953523546457
2375,2375,1071800,10718.48,10720.0, Just destroyed it,"[50387, 2329, 6572, 340, 50463]",0.0,-0.13508377377949063,1.7837837837837838,0.0003001708537340164
2376,2376,1071800,10720.0,10722.72, Tor opened the chicken coop and ate all the chickens,"[50463, 4022, 4721, 262, 9015, 763, 404, 290, 15063, 477, 262, 25972, 50599]",0.0,-0.13508377377949063,1.7837837837837838,0.0003001708537340164
2377,2377,1071800,10723.28,10728.56," Through the wire. Yeah, they pulled the wire off. They pulled the the wood off of it. They're predators, man","[50627, 9561, 262, 6503, 13, 9425, 11, 484, 5954, 262, 6503, 572, 13, 1119, 5954, 262, 262, 4898, 572, 286, 340, 13, 1119, 821, 23311, 11, 582, 50891]",0.0,-0.13508377377949063,1.7837837837837838,0.0003001708537340164
2378,2378,1071800,10728.64,10731.76," Yeah, they're real smart. They're devious little cunts","[50895, 9425, 11, 484, 821, 1103, 4451, 13, 1119, 821, 390, 1442, 1310, 269, 34115, 51051]",0.0,-0.13508377377949063,1.7837837837837838,0.0003001708537340164
2379,2379,1071800,10732.48,10736.24, Utah they don't do they they don't pay you out here for dead ones,"[51087, 10202, 484, 836, 470, 466, 484, 484, 836, 470, 1414, 345, 503, 994, 329, 2636, 3392, 51275]",0.0,-0.13508377377949063,1.7837837837837838,0.0003001708537340164
2380,2380,1071800,10736.72,10740.64," And you get 50 bucks in the ear. Yeah, and you tell that's worth it","[51299, 843, 345, 651, 2026, 24780, 287, 262, 1027, 13, 9425, 11, 290, 345, 1560, 326, 338, 2861, 340, 51495]",0.0,-0.13508377377949063,1.7837837837837838,0.0003001708537340164
2381,2381,1071800,10741.12,10743.12, The thing is you can't kill them,"[51519, 383, 1517, 318, 345, 460, 470, 1494, 606, 51619]",0.0,-0.13508377377949063,1.7837837837837838,0.0003001708537340164
2382,2382,1071800,10743.12,10746.0, They just keep when you kill them it has the opposite effect,"[51619, 1119, 655, 1394, 618, 345, 1494, 606, 340, 468, 262, 6697, 1245, 51763]",0.0,-0.13508377377949063,1.7837837837837838,0.0003001708537340164
2383,2383,1074600,10746.56,10749.76, What happens with coyotes is they do that roll call with a yellow,"[50391, 1867, 4325, 351, 34003, 6421, 318, 484, 466, 326, 4836, 869, 351, 257, 7872, 50551]",0.0,-0.18772999121218312,1.7293577981651376,0.00011681356409098953
2384,2384,1074600,10750.64,10755.52, Right. Well when one stops responding like when one's missing everybody's checking it out,"[50595, 6498, 13, 3894, 618, 530, 9911, 14409, 588, 618, 530, 338, 4814, 7288, 338, 10627, 340, 503, 50839]",0.0,-0.18772999121218312,1.7293577981651376,0.00011681356409098953
2385,2385,1074600,10755.68,10758.16," No, the one the female start growing more eggs","[50847, 1400, 11, 262, 530, 262, 4048, 923, 3957, 517, 9653, 50971]",0.0,-0.18772999121218312,1.7293577981651376,0.00011681356409098953
2386,2386,1074600,10758.96,10764.48," No shit. Yes, so they have more babies. So when female coyotes are in um","[51011, 1400, 7510, 13, 3363, 11, 523, 484, 423, 517, 11903, 13, 1406, 618, 4048, 34003, 6421, 389, 287, 23781, 51287]",0.0,-0.18772999121218312,1.7293577981651376,0.00011681356409098953
2387,2387,1074600,10765.44,10770.16, What is it a clan a pack when female coyotes are in a pack and coyote goes missing,"[51335, 1867, 318, 340, 257, 19065, 257, 2353, 618, 4048, 34003, 6421, 389, 287, 257, 2353, 290, 34003, 1258, 2925, 4814, 51571]",0.0,-0.18772999121218312,1.7293577981651376,0.00011681356409098953
2388,2388,1074600,10770.96,10772.96, All of the females,"[51611, 1439, 286, 262, 12366, 51711]",0.0,-0.18772999121218312,1.7293577981651376,0.00011681356409098953
2389,2389,1077296,10772.96,10777.919999999998, Generate more children. So if they would normally have like three kids now they have six,"[50363, 2980, 378, 517, 1751, 13, 1406, 611, 484, 561, 7685, 423, 588, 1115, 3988, 783, 484, 423, 2237, 50611]",0.0,-0.19901935389784517,1.8115384615384615,0.0010809440864250064
2390,2390,1077296,10778.56,10780.24, So it's like unlimited money,"[50643, 1406, 340, 338, 588, 15822, 1637, 50727]",0.0,-0.19901935389784517,1.8115384615384615,0.0010809440864250064
2391,2391,1077296,10780.24,10785.599999999999," Well, they as long as you you have to kill them all you have to kill them all because as long as you persecute them","[50727, 3894, 11, 484, 355, 890, 355, 345, 345, 423, 284, 1494, 606, 477, 345, 423, 284, 1494, 606, 477, 780, 355, 890, 355, 345, 583, 2363, 1133, 606, 50995]",0.0,-0.19901935389784517,1.8115384615384615,0.0010809440864250064
