,id,seek,start,end,text,tokens,temperature,avg_logprob,compression_ratio,no_speech_prob
1509,1509,703616,7039.36,7045.28, Most definitely. But is it better? Here's the thing is it better if you grandma dies of cancer or is it better,"[50523, 4042, 4753, 13, 887, 318, 340, 1365, 30, 3423, 338, 262, 1517, 318, 340, 1365, 611, 345, 49890, 10564, 286, 4890, 393, 318, 340, 1365, 50819]",0.0,-0.2276402438979551,1.5934579439252337,0.0005707466625608504
1510,1510,703616,7046.0,7053.599999999999," If you have some technology that keeps you from ever getting any disease ever, but it's embedded inside your body and it's controlled","[50855, 1002, 345, 423, 617, 3037, 326, 7622, 345, 422, 1683, 1972, 597, 4369, 1683, 11, 475, 340, 338, 14553, 2641, 534, 1767, 290, 340, 338, 6856, 51235]",0.0,-0.2276402438979551,1.5934579439252337,0.0005707466625608504
1511,1511,703616,7054.96,7060.5599999999995, By a team of scientists. But it comes to I was watching something,"[51303, 2750, 257, 1074, 286, 5519, 13, 887, 340, 2058, 284, 314, 373, 4964, 1223, 51583]",0.0,-0.2276402438979551,1.5934579439252337,0.0005707466625608504
1512,1512,706056,7061.360000000001,7067.120000000001, The robot can walk and swim so gets in your cells makes its way through to your brain and fucking explodes,"[50403, 383, 9379, 460, 2513, 290, 9422, 523, 3011, 287, 534, 4778, 1838, 663, 835, 832, 284, 534, 3632, 290, 9372, 38711, 50691]",0.0,-0.22119861178927952,1.6282051282051282,0.0040391129441559315
1513,1513,706056,7067.76,7075.360000000001, Jihad. This is the craziest thing ever that what they're willing to do today with um with technology and,"[50723, 35243, 13, 770, 318, 262, 27627, 6386, 1517, 1683, 326, 644, 484, 821, 4684, 284, 466, 1909, 351, 23781, 351, 3037, 290, 51103]",0.0,-0.22119861178927952,1.6282051282051282,0.0040391129441559315
1514,1514,706056,7076.0,7083.120000000001, Like what they're experimenting on what we're seeing in these videos is just a tiny amount of what's possible from them in the future,"[51135, 4525, 644, 484, 821, 27826, 319, 644, 356, 821, 4379, 287, 777, 5861, 318, 655, 257, 7009, 2033, 286, 644, 338, 1744, 422, 606, 287, 262, 2003, 51491]",0.0,-0.22119861178927952,1.6282051282051282,0.0040391129441559315
1515,1515,706056,7083.6,7085.6, I mean they could,"[51515, 314, 1612, 484, 714, 51615]",0.0,-0.22119861178927952,1.6282051282051282,0.0040391129441559315
1516,1516,706056,7085.6,7087.6, Man we could have,"[51615, 1869, 356, 714, 423, 51715]",0.0,-0.22119861178927952,1.6282051282051282,0.0040391129441559315
1517,1517,708760,7087.76,7092.400000000001, Insane technology of changing human bodies inside our lifetime,"[50371, 7088, 1531, 3037, 286, 5609, 1692, 5920, 2641, 674, 10869, 50603]",0.0,-0.19531410618832237,1.4680851063829787,0.0034902384504675865
1518,1518,708760,7094.4800000000005,7096.4800000000005, You're in shape,"[50707, 921, 821, 287, 5485, 50807]",0.0,-0.19531410618832237,1.4680851063829787,0.0034902384504675865
1519,1519,708760,7096.4800000000005,7103.92," Right, I try my best me not so much. Do you ever want to be? No. Well, there you go then. Yeah, I mean i'm happy here","[50807, 6498, 11, 314, 1949, 616, 1266, 502, 407, 523, 881, 13, 2141, 345, 1683, 765, 284, 307, 30, 1400, 13, 3894, 11, 612, 345, 467, 788, 13, 9425, 11, 314, 1612, 1312, 1101, 3772, 994, 51179]",0.0,-0.19531410618832237,1.4680851063829787,0.0034902384504675865
1520,1520,708760,7104.400000000001,7105.84, As long as you're happy,"[51203, 1081, 890, 355, 345, 821, 3772, 51275]",0.0,-0.19531410618832237,1.4680851063829787,0.0034902384504675865
1521,1521,708760,7105.84,7111.68, But like we were talking about earlier it comes to I guess generation wise yes because,"[51275, 887, 588, 356, 547, 3375, 546, 2961, 340, 2058, 284, 314, 4724, 5270, 10787, 3763, 780, 51567]",0.0,-0.19531410618832237,1.4680851063829787,0.0034902384504675865
1522,1522,708760,7112.96,7115.52, If you have to pantomime a cell phone,"[51631, 1002, 345, 423, 284, 279, 11456, 524, 257, 2685, 3072, 51759]",0.0,-0.19531410618832237,1.4680851063829787,0.0034902384504675865
1523,1523,711552,7116.160000000001,7121.280000000001," How do you do it? You got to do like this like this. Yeah, but I saw a video","[50395, 1374, 466, 345, 466, 340, 30, 921, 1392, 284, 466, 588, 428, 588, 428, 13, 9425, 11, 475, 314, 2497, 257, 2008, 50651]",0.0,-0.22571287262305784,1.6062176165803108,0.00061597436433658
1524,1524,711552,7123.120000000001,7128.56," Of are they doing this now they're doing this. Oh, okay, that makes sense because of the iPhone","[50743, 3226, 389, 484, 1804, 428, 783, 484, 821, 1804, 428, 13, 3966, 11, 8788, 11, 326, 1838, 2565, 780, 286, 262, 7133, 51015]",0.0,-0.22571287262305784,1.6062176165803108,0.00061597436433658
1525,1525,711552,7129.200000000001,7131.68," Yeah, but we do it like this. Yeah","[51047, 9425, 11, 475, 356, 466, 340, 588, 428, 13, 9425, 51171]",0.0,-0.22571287262305784,1.6062176165803108,0.00061597436433658
1526,1526,711552,7133.280000000001,7134.8, so,"[51251, 523, 51327]",0.0,-0.22571287262305784,1.6062176165803108,0.00061597436433658
1527,1527,711552,7134.8,7137.84, There there maybe later comes a time,"[51327, 1318, 612, 3863, 1568, 2058, 257, 640, 51479]",0.0,-0.22571287262305784,1.6062176165803108,0.00061597436433658
1528,1528,711552,7138.4800000000005,7142.64," Because like I said, I will never drive a fully autonomous car","[51511, 4362, 588, 314, 531, 11, 314, 481, 1239, 3708, 257, 3938, 18284, 1097, 51719]",0.0,-0.22571287262305784,1.6062176165803108,0.00061597436433658
1529,1529,714264,7142.88,7144.88, hmm,"[50375, 289, 3020, 50475]",0.0,-0.16562317638862423,1.6706349206349207,0.0005238177836872637
1530,1530,714264,7144.88,7147.360000000001, But I hear you I'm sure there's someone,"[50475, 887, 314, 3285, 345, 314, 1101, 1654, 612, 338, 2130, 50599]",0.0,-0.16562317638862423,1.6706349206349207,0.0005238177836872637
1531,1531,714264,7148.08,7151.4400000000005," Years down the line that will be like, oh, fuck yeah. Are you kidding me?","[50635, 13212, 866, 262, 1627, 326, 481, 307, 588, 11, 11752, 11, 5089, 10194, 13, 4231, 345, 26471, 502, 30, 50803]",0.0,-0.16562317638862423,1.6706349206349207,0.0005238177836872637
1532,1532,714264,7152.8,7154.8, I think they're gonna do it because it's safer,"[50871, 314, 892, 484, 821, 8066, 466, 340, 780, 340, 338, 14178, 50971]",0.0,-0.16562317638862423,1.6706349206349207,0.0005238177836872637
1533,1533,714264,7155.04,7157.76, And I think that's why it's gonna be really hard to get people to,"[50983, 843, 314, 892, 326, 338, 1521, 340, 338, 8066, 307, 1107, 1327, 284, 651, 661, 284, 51119]",0.0,-0.16562317638862423,1.6706349206349207,0.0005238177836872637
1534,1534,714264,7158.56,7161.12, Sign off on the idea of letting people drive their own cars,"[51159, 5865, 572, 319, 262, 2126, 286, 9616, 661, 3708, 511, 898, 5006, 51287]",0.0,-0.16562317638862423,1.6706349206349207,0.0005238177836872637
1535,1535,714264,7162.0,7164.96, It's the thing that we got really used to that we only got used to for a little while,"[51331, 632, 338, 262, 1517, 326, 356, 1392, 1107, 973, 284, 326, 356, 691, 1392, 973, 284, 329, 257, 1310, 981, 51479]",0.0,-0.16562317638862423,1.6706349206349207,0.0005238177836872637
1536,1536,714264,7165.280000000001,7167.280000000001, I mean there was no cars in,"[51495, 314, 1612, 612, 373, 645, 5006, 287, 51595]",0.0,-0.16562317638862423,1.6706349206349207,0.0005238177836872637
1537,1537,714264,7167.4400000000005,7169.4400000000005," 1,700 and in the","[51603, 352, 11, 9879, 290, 287, 262, 51703]",0.0,-0.16562317638862423,1.6706349206349207,0.0005238177836872637
1538,1538,716944,7169.679999999999,7173.759999999999, 2020s everyone's got a fucking car there everywhere so in that time period,"[50375, 12131, 82, 2506, 338, 1392, 257, 9372, 1097, 612, 8347, 523, 287, 326, 640, 2278, 50579]",0.0,-0.20055114305936372,1.7479338842975207,0.003950225189328194
1539,1539,716944,7174.08,7180.24, We went from all of human history no cars to the invention of a car whenever the fuck that was we figured that out once,"[50595, 775, 1816, 422, 477, 286, 1692, 2106, 645, 5006, 284, 262, 14250, 286, 257, 1097, 8797, 262, 5089, 326, 373, 356, 11638, 326, 503, 1752, 50903]",0.0,-0.20055114305936372,1.7479338842975207,0.003950225189328194
1540,1540,716944,7180.96,7184.719999999999, 1800s or something the 1800s they figured out the first car,"[50939, 21431, 82, 393, 1223, 262, 21431, 82, 484, 11638, 503, 262, 717, 1097, 51127]",0.0,-0.20055114305936372,1.7479338842975207,0.003950225189328194
1541,1541,716944,7185.759999999999,7189.919999999999, That's not that long and then we just decide well you have to have a car basic human right,"[51179, 1320, 338, 407, 326, 890, 290, 788, 356, 655, 5409, 880, 345, 423, 284, 423, 257, 1097, 4096, 1692, 826, 51387]",0.0,-0.20055114305936372,1.7479338842975207,0.003950225189328194
1542,1542,716944,7190.48,7196.48, Don't really have to have a car but cars are awesome like an old car is a car,"[51415, 2094, 470, 1107, 423, 284, 423, 257, 1097, 475, 5006, 389, 7427, 588, 281, 1468, 1097, 318, 257, 1097, 51715]",0.0,-0.20055114305936372,1.7479338842975207,0.003950225189328194
1543,1543,719648,7197.12,7199.12, How are you gonna get to your job?,"[50395, 1374, 389, 345, 8066, 651, 284, 534, 1693, 30, 50495]",0.0,-0.17287904565984552,1.8151815181518152,0.00013852625852450728
1544,1544,719648,7199.12,7202.48, Public transportation if it's better that's what but that's a car,"[50495, 5094, 9358, 611, 340, 338, 1365, 326, 338, 644, 475, 326, 338, 257, 1097, 50663]",0.0,-0.17287904565984552,1.8151815181518152,0.00013852625852450728
1545,1545,719648,7203.12,7207.44," Well, not necessarily it could be like a tube where people fly through it","[50695, 3894, 11, 407, 6646, 340, 714, 307, 588, 257, 12403, 810, 661, 6129, 832, 340, 50911]",0.0,-0.17287904565984552,1.8151815181518152,0.00013852625852450728
1546,1546,719648,7207.44,7212.799999999999, It's all magnets on the other end to keep it from crashing into each other they could figure out some weird shit that has nothing to do with cars,"[50911, 632, 338, 477, 37446, 319, 262, 584, 886, 284, 1394, 340, 422, 21899, 656, 1123, 584, 484, 714, 3785, 503, 617, 7650, 7510, 326, 468, 2147, 284, 466, 351, 5006, 51179]",0.0,-0.17287904565984552,1.8151815181518152,0.00013852625852450728
1547,1547,719648,7214.0,7214.799999999999, Too late,"[51239, 14190, 2739, 51279]",0.0,-0.17287904565984552,1.8151815181518152,0.00013852625852450728
1548,1548,719648,7214.799999999999,7216.24, This is not totally too late,"[51279, 770, 318, 407, 6635, 1165, 2739, 51351]",0.0,-0.17287904565984552,1.8151815181518152,0.00013852625852450728
1549,1549,719648,7216.24,7221.12, I think if they could figure out a way to convince people that there will be no more auto accidents,"[51351, 314, 892, 611, 484, 714, 3785, 503, 257, 835, 284, 11508, 661, 326, 612, 481, 307, 645, 517, 8295, 17390, 51595]",0.0,-0.17287904565984552,1.8151815181518152,0.00013852625852450728
1550,1550,719648,7221.28,7226.4, That would be a good way to get people on board right they said no more auto accidents ever,"[51603, 1320, 561, 307, 257, 922, 835, 284, 651, 661, 319, 3096, 826, 484, 531, 645, 517, 8295, 17390, 1683, 51859]",0.0,-0.17287904565984552,1.8151815181518152,0.00013852625852450728
1551,1551,722648,7226.879999999999,7232.5599999999995," People would probably be like, oh, well, how can you argue against that you selfish fuck you want to shift through your own gears and","[50383, 4380, 561, 2192, 307, 588, 11, 11752, 11, 880, 11, 703, 460, 345, 7267, 1028, 326, 345, 20363, 5089, 345, 765, 284, 6482, 832, 534, 898, 28713, 290, 50667]",0.0,-0.1657351156822721,1.7912457912457913,4.473232547752559e-05
1552,1552,722648,7232.719999999999,7238.5599999999995, Kill my nana and that's that's what people are going to do. They're going to give into it because they don't want to be selfish,"[50675, 12265, 616, 299, 2271, 290, 326, 338, 326, 338, 644, 661, 389, 1016, 284, 466, 13, 1119, 821, 1016, 284, 1577, 656, 340, 780, 484, 836, 470, 765, 284, 307, 20363, 50967]",0.0,-0.1657351156822721,1.7912457912457913,4.473232547752559e-05
1553,1553,722648,7239.599999999999,7244.16," I mean, this is like the slow slide into accepting that we're a part of technology","[51019, 314, 1612, 11, 428, 318, 588, 262, 3105, 10649, 656, 12598, 326, 356, 821, 257, 636, 286, 3037, 51247]",0.0,-0.1657351156822721,1.7912457912457913,4.473232547752559e-05
1554,1554,722648,7244.24,7249.599999999999, Right the slow slide is us hanging on to our biology as much as possible. I think that's a good thing,"[51251, 6498, 262, 3105, 10649, 318, 514, 10938, 319, 284, 674, 17219, 355, 881, 355, 1744, 13, 314, 892, 326, 338, 257, 922, 1517, 51519]",0.0,-0.1657351156822721,1.7912457912457913,4.473232547752559e-05
1555,1555,722648,7250.08,7254.0," I think biology is awesome, but I see the writing on the wall. I see where it's going","[51543, 314, 892, 17219, 318, 7427, 11, 475, 314, 766, 262, 3597, 319, 262, 3355, 13, 314, 766, 810, 340, 338, 1016, 51739]",0.0,-0.1657351156822721,1.7912457912457913,4.473232547752559e-05
1556,1556,725400,7254.48,7259.36," Yeah, I mean, it's going away. Yeah, we're sliding into this new existence","[50387, 9425, 11, 314, 1612, 11, 340, 338, 1016, 1497, 13, 9425, 11, 356, 821, 22292, 656, 428, 649, 6224, 50631]",0.0,-0.15461235715631852,1.6536796536796536,0.001861467259004712
1557,1557,725400,7259.76,7263.12, But we we're real insistent on keeping our old ways. It's real weird,"[50651, 887, 356, 356, 821, 1103, 1035, 7609, 319, 5291, 674, 1468, 2842, 13, 632, 338, 1103, 7650, 50819]",0.0,-0.15461235715631852,1.6536796536796536,0.001861467259004712
1558,1558,725400,7263.92,7269.44, I know in terms of like I like to hear the rumble of an engine. I'm one of those people. I love a rumble of an engine. Right,"[50859, 314, 760, 287, 2846, 286, 588, 314, 588, 284, 3285, 262, 7440, 903, 286, 281, 3113, 13, 314, 1101, 530, 286, 883, 661, 13, 314, 1842, 257, 7440, 903, 286, 281, 3113, 13, 6498, 51135]",0.0,-0.15461235715631852,1.6536796536796536,0.001861467259004712
1559,1559,725400,7270.88,7276.8," But then it I mean I I don't want to backtrack too much, but I have been but","[51207, 887, 788, 340, 314, 1612, 314, 314, 836, 470, 765, 284, 736, 11659, 1165, 881, 11, 475, 314, 423, 587, 475, 51503]",0.0,-0.15461235715631852,1.6536796536796536,0.001861467259004712
1560,1560,725400,7278.24,7280.24, At the end of the day,"[51575, 1629, 262, 886, 286, 262, 1110, 51675]",0.0,-0.15461235715631852,1.6536796536796536,0.001861467259004712
1561,1561,725400,7280.64,7282.64, I would rather,"[51695, 314, 561, 2138, 51795]",0.0,-0.15461235715631852,1.6536796536796536,0.001861467259004712
1562,1562,728264,7283.04,7286.08, Be responsible for my decisions. I suppose yes,"[50383, 1355, 4497, 329, 616, 5370, 13, 314, 11691, 3763, 50535]",0.0,-0.14394184899708581,1.7023411371237458,5.9133704780833796e-05
1563,1563,728264,7286.72,7288.240000000001," Well, you're an artist","[50567, 3894, 11, 345, 821, 281, 6802, 50643]",0.0,-0.14394184899708581,1.7023411371237458,5.9133704780833796e-05
1564,1564,728264,7288.240000000001,7290.240000000001, You know you're,"[50643, 921, 760, 345, 821, 50743]",0.0,-0.14394184899708581,1.7023411371237458,5.9133704780833796e-05
1565,1565,728264,7290.240000000001,7292.88, Just being an artist is a different kind of person,"[50743, 2329, 852, 281, 6802, 318, 257, 1180, 1611, 286, 1048, 50875]",0.0,-0.14394184899708581,1.7023411371237458,5.9133704780833796e-05
1566,1566,728264,7292.88,7298.08, It's a person who's chosen a path of doing whatever the fuck they want to do like expressing themselves professionally,"[50875, 632, 338, 257, 1048, 508, 338, 7147, 257, 3108, 286, 1804, 4232, 262, 5089, 484, 765, 284, 466, 588, 16621, 2405, 28049, 51135]",0.0,-0.14394184899708581,1.7023411371237458,5.9133704780833796e-05
1567,1567,728264,7298.4800000000005,7300.4800000000005, Of course you don't want someone driving you,"[51155, 3226, 1781, 345, 836, 470, 765, 2130, 5059, 345, 51255]",0.0,-0.14394184899708581,1.7023411371237458,5.9133704780833796e-05
1568,1568,728264,7300.4800000000005,7306.240000000001," Feels good to drive. Mm. Yeah, there's experiences that you get in life. You want to you want to feel them all","[51255, 5452, 1424, 922, 284, 3708, 13, 337, 76, 13, 9425, 11, 612, 338, 6461, 326, 345, 651, 287, 1204, 13, 921, 765, 284, 345, 765, 284, 1254, 606, 477, 51543]",0.0,-0.14394184899708581,1.7023411371237458,5.9133704780833796e-05
1569,1569,728264,7306.8,7310.320000000001, You know and some of them are dangerous some of them come with consequences if you make a mistake,"[51571, 921, 760, 290, 617, 286, 606, 389, 4923, 617, 286, 606, 1282, 351, 6948, 611, 345, 787, 257, 7457, 51747]",0.0,-0.14394184899708581,1.7023411371237458,5.9133704780833796e-05
1570,1570,731032,7310.4,7311.84, That's how you get better,"[50367, 1320, 338, 703, 345, 651, 1365, 50439]",0.0,-0.1615690231323242,1.75,0.00019153751782141626
1571,1571,731032,7311.84,7313.84, if you take away all consequences,"[50439, 611, 345, 1011, 1497, 477, 6948, 50539]",0.0,-0.1615690231323242,1.75,0.00019153751782141626
1572,1572,731032,7315.28,7320.799999999999, My concern is that we're going to just like keep protecting ourselves more and more and more and more and more and more and more,"[50611, 2011, 2328, 318, 326, 356, 821, 1016, 284, 655, 588, 1394, 10192, 6731, 517, 290, 517, 290, 517, 290, 517, 290, 517, 290, 517, 290, 517, 50887]",0.0,-0.1615690231323242,1.75,0.00019153751782141626
1573,1573,731032,7320.799999999999,7322.799999999999, To the point where we're just,"[50887, 1675, 262, 966, 810, 356, 821, 655, 50987]",0.0,-0.1615690231323242,1.75,0.00019153751782141626
1574,1574,731032,7323.5199999999995,7328.0, incapable of withstanding any adversity. That's what I'm worried about with people,"[51023, 23402, 286, 351, 5646, 597, 42628, 13, 1320, 338, 644, 314, 1101, 7960, 546, 351, 661, 51247]",0.0,-0.1615690231323242,1.75,0.00019153751782141626
1575,1575,731032,7330.0,7334.799999999999," Well, and that's what I say I this is this is why I would rather","[51347, 3894, 11, 290, 326, 338, 644, 314, 910, 314, 428, 318, 428, 318, 1521, 314, 561, 2138, 51587]",0.0,-0.1615690231323242,1.75,0.00019153751782141626
1576,1576,731032,7336.4,7338.719999999999, Drive my own car is because like,"[51667, 9974, 616, 898, 1097, 318, 780, 588, 51783]",0.0,-0.1615690231323242,1.75,0.00019153751782141626
1577,1577,734032,7340.88,7342.88, You never,"[50391, 921, 1239, 50491]",0.0,-0.1900828035571907,1.60752688172043,6.579040928045288e-05
1578,1578,734032,7343.2,7350.0, Fully you never you wake up and you never know what's happening. Right. Right. You never know what's going to happen during the day,"[50507, 40234, 345, 1239, 345, 7765, 510, 290, 345, 1239, 760, 644, 338, 5836, 13, 6498, 13, 6498, 13, 921, 1239, 760, 644, 338, 1016, 284, 1645, 1141, 262, 1110, 50847]",0.0,-0.1900828035571907,1.60752688172043,6.579040928045288e-05
1579,1579,734032,7350.639999999999,7354.32," There's something good about that. Yeah, no, it's incredible but","[50879, 1318, 338, 1223, 922, 546, 326, 13, 9425, 11, 645, 11, 340, 338, 8082, 475, 51063]",0.0,-0.1900828035571907,1.60752688172043,6.579040928045288e-05
1580,1580,734032,7355.679999999999,7357.679999999999, we're all,"[51131, 356, 821, 477, 51231]",0.0,-0.1900828035571907,1.60752688172043,6.579040928045288e-05
1581,1581,734032,7357.679999999999,7359.679999999999, people and,"[51231, 661, 290, 51331]",0.0,-0.1900828035571907,1.60752688172043,6.579040928045288e-05
1582,1582,734032,7362.5599999999995,7366.32, I would rather have that be biological than,"[51475, 314, 561, 2138, 423, 326, 307, 10685, 621, 51663]",0.0,-0.1900828035571907,1.60752688172043,6.579040928045288e-05
1583,1583,734032,7367.679999999999,7369.679999999999, A computer. Yeah controlled,"[51731, 317, 3644, 13, 9425, 6856, 51831]",0.0,-0.1900828035571907,1.60752688172043,6.579040928045288e-05
1584,1584,737032,7370.639999999999,7375.599999999999, And that's and that's where I'm coming from I suppose I'm with you,"[50379, 843, 326, 338, 290, 326, 338, 810, 314, 1101, 2406, 422, 314, 11691, 314, 1101, 351, 345, 50627]",0.0,-0.1311125234395516,1.7624521072796935,0.00022619594528805465
1585,1585,737032,7376.32,7381.92, I'm with you. I see both sides of it. I really do right. I'm not on a particular side of it,"[50663, 314, 1101, 351, 345, 13, 314, 766, 1111, 5389, 286, 340, 13, 314, 1107, 466, 826, 13, 314, 1101, 407, 319, 257, 1948, 1735, 286, 340, 50943]",0.0,-0.1311125234395516,1.7624521072796935,0.00022619594528805465
1586,1586,737032,7382.0,7384.0, Right because I think I'm,"[50947, 6498, 780, 314, 892, 314, 1101, 51047]",0.0,-0.1311125234395516,1.7624521072796935,0.00022619594528805465
1587,1587,737032,7384.0,7390.88, I think what all of us are doing is like witnessing these changes happening in real time and trying to hold on to whatever ground,"[51047, 314, 892, 644, 477, 286, 514, 389, 1804, 318, 588, 31121, 777, 2458, 5836, 287, 1103, 640, 290, 2111, 284, 1745, 319, 284, 4232, 2323, 51391]",0.0,-0.1311125234395516,1.7624521072796935,0.00022619594528805465
1588,1588,737032,7390.88,7395.2," We have that we think is important and sacred. You know, I think that's one of the things we're doing where","[51391, 775, 423, 326, 356, 892, 318, 1593, 290, 13626, 13, 921, 760, 11, 314, 892, 326, 338, 530, 286, 262, 1243, 356, 821, 1804, 810, 51607]",0.0,-0.1311125234395516,1.7624521072796935,0.00022619594528805465
1589,1589,737032,7396.96,7399.12, You know people that ride motorcycles,"[51695, 921, 760, 661, 326, 6594, 39404, 51803]",0.0,-0.1311125234395516,1.7624521072796935,0.00022619594528805465
1590,1590,739912,7399.12,7404.72, They want to ride harleys and loud engines and it's romantic. It's exciting all those things. I think are cool,"[50363, 1119, 765, 284, 6594, 3971, 21325, 290, 7812, 11874, 290, 340, 338, 14348, 13, 632, 338, 7895, 477, 883, 1243, 13, 314, 892, 389, 3608, 50643]",0.0,-0.13201910304272269,1.7617328519855595,0.00032040721271187067
1591,1591,739912,7405.36,7407.36, But I see the right on the wall,"[50675, 887, 314, 766, 262, 826, 319, 262, 3355, 50775]",0.0,-0.13201910304272269,1.7617328519855595,0.00032040721271187067
1592,1592,739912,7407.36,7410.88," Like if a hundred years from now, it's it's all going to be autonomous. Yeah","[50775, 4525, 611, 257, 3470, 812, 422, 783, 11, 340, 338, 340, 338, 477, 1016, 284, 307, 18284, 13, 9425, 50951]",0.0,-0.13201910304272269,1.7617328519855595,0.00032040721271187067
1593,1593,739912,7411.599999999999,7413.36, There's going to be very few,"[50987, 1318, 338, 1016, 284, 307, 845, 1178, 51075]",0.0,-0.13201910304272269,1.7617328519855595,0.00032040721271187067
1594,1594,739912,7413.36,7417.92," licenses that we give away to people to let them drive their own cars, right? It's probably","[51075, 16625, 326, 356, 1577, 1497, 284, 661, 284, 1309, 606, 3708, 511, 898, 5006, 11, 826, 30, 632, 338, 2192, 51303]",0.0,-0.13201910304272269,1.7617328519855595,0.00032040721271187067
1595,1595,739912,7418.88,7423.04, It's probably all going to be controlled by some central system that keeps you at a certain pace,"[51351, 632, 338, 2192, 477, 1016, 284, 307, 6856, 416, 617, 4318, 1080, 326, 7622, 345, 379, 257, 1728, 8761, 51559]",0.0,-0.13201910304272269,1.7617328519855595,0.00032040721271187067
1596,1596,739912,7424.0,7426.88," You know, you can't it's it's going to be annoying","[51607, 921, 760, 11, 345, 460, 470, 340, 338, 340, 338, 1016, 284, 307, 15774, 51751]",0.0,-0.13201910304272269,1.7617328519855595,0.00032040721271187067
1597,1597,742912,7429.36,7433.04, It's going to be annoying. It's going to be just drive to work. No more fun anymore,"[50375, 632, 338, 1016, 284, 307, 15774, 13, 632, 338, 1016, 284, 307, 655, 3708, 284, 670, 13, 1400, 517, 1257, 7471, 50559]",0.0,-0.2140315400452173,1.7450980392156863,0.000627526140306145
1598,1598,742912,7433.5199999999995,7435.5199999999995, Before it's like if you,"[50583, 7413, 340, 338, 588, 611, 345, 50683]",0.0,-0.2140315400452173,1.7450980392156863,0.000627526140306145
1599,1599,742912,7435.68,7437.68, Worked at a job and you had a,"[50691, 5521, 276, 379, 257, 1693, 290, 345, 550, 257, 50791]",0.0,-0.2140315400452173,1.7450980392156863,0.000627526140306145
1600,1600,742912,7438.0,7444.0," 68 Camaro, right and you drove your 68 Camaro to work while you're driving down a street listening to white snake","[50807, 8257, 7298, 12022, 11, 826, 290, 345, 10357, 534, 8257, 7298, 12022, 284, 670, 981, 345, 821, 5059, 866, 257, 4675, 8680, 284, 2330, 17522, 51107]",0.0,-0.2140315400452173,1.7450980392156863,0.000627526140306145
1601,1601,742912,7444.4,7450.32," Here I go again on my own and you're driving this fucking thing and you're shifting your own gears, right?","[51127, 3423, 314, 467, 757, 319, 616, 898, 290, 345, 821, 5059, 428, 9372, 1517, 290, 345, 821, 15852, 534, 898, 28713, 11, 826, 30, 51423]",0.0,-0.2140315400452173,1.7450980392156863,0.000627526140306145
1602,1602,742912,7450.48,7455.68, That guy's having a good-ass time and someone can come along take that away and say no,"[51431, 1320, 3516, 338, 1719, 257, 922, 12, 562, 640, 290, 2130, 460, 1282, 1863, 1011, 326, 1497, 290, 910, 645, 51691]",0.0,-0.2140315400452173,1.7450980392156863,0.000627526140306145
1603,1603,745568,7455.84,7459.92," No, no, you have to get in the autonomous tube now because safety safety's important","[50371, 1400, 11, 645, 11, 345, 423, 284, 651, 287, 262, 18284, 12403, 783, 780, 3747, 3747, 338, 1593, 50575]",0.0,-0.16410862731933593,1.7870036101083033,0.0012409348273649812
1604,1604,745568,7460.16,7464.0, So this poor fucking dude who looked forward to his drive to work,"[50587, 1406, 428, 3595, 9372, 18396, 508, 3114, 2651, 284, 465, 3708, 284, 670, 50779]",0.0,-0.16410862731933593,1.7870036101083033,0.0012409348273649812
