,id,seek,start,end,text,tokens,temperature,avg_logprob,compression_ratio,no_speech_prob
420,420,148152,1488.16,1492.08, things we have today that could actually be better as interactive holograms.,"[50695, 1243, 356, 423, 1909, 326, 714, 1682, 307, 1365, 355, 14333, 31912, 9474, 13, 50891]",0.0,-0.1631873773068798,1.6091954022988506,0.00473763607442379
421,421,148152,1492.72,1497.36," But then beyond that, I think the most important thing, obviously, is people.","[50923, 887, 788, 3675, 326, 11, 314, 892, 262, 749, 1593, 1517, 11, 6189, 11, 318, 661, 13, 51155]",0.0,-0.1631873773068798,1.6091954022988506,0.00473763607442379
422,422,148152,1497.52,1503.92," So the ability to have these mixed hangouts, whether they're social or meetings where,","[51163, 1406, 262, 2694, 284, 423, 777, 7668, 8181, 5269, 11, 1771, 484, 821, 1919, 393, 8292, 810, 11, 51483]",0.0,-0.1631873773068798,1.6091954022988506,0.00473763607442379
423,423,148152,1504.48,1509.44," you show up to a conference room, you're wearing glasses or a headset in the very near term,","[51511, 345, 905, 510, 284, 257, 4495, 2119, 11, 345, 821, 5762, 15232, 393, 257, 23492, 287, 262, 845, 1474, 3381, 11, 51759]",0.0,-0.1631873773068798,1.6091954022988506,0.00473763607442379
424,424,150944,1509.44,1512.8," but hopefully by over the next five years, glasses or so.","[50363, 475, 11481, 416, 625, 262, 1306, 1936, 812, 11, 15232, 393, 523, 13, 50531]",0.0,-0.15215790946528596,1.7656903765690377,0.0003919360460713506
425,425,150944,1513.2,1516.16," And, you know, you're there physically.","[50551, 843, 11, 345, 760, 11, 345, 821, 612, 10170, 13, 50699]",0.0,-0.15215790946528596,1.7656903765690377,0.0003919360460713506
426,426,150944,1516.16,1520.56," Some people are there physically, but other people are just there as holograms.","[50699, 2773, 661, 389, 612, 10170, 11, 475, 584, 661, 389, 655, 612, 355, 31912, 9474, 13, 50919]",0.0,-0.15215790946528596,1.7656903765690377,0.0003919360460713506
427,427,150944,1520.56,1523.68, And it feels like it's them who are right there.,"[50919, 843, 340, 5300, 588, 340, 338, 606, 508, 389, 826, 612, 13, 51075]",0.0,-0.15215790946528596,1.7656903765690377,0.0003919360460713506
428,428,150944,1523.68,1526.64," And also, by the way, another thing that I think is going to be fascinating about being able","[51075, 843, 635, 11, 416, 262, 835, 11, 1194, 1517, 326, 314, 892, 318, 1016, 284, 307, 13899, 546, 852, 1498, 51223]",0.0,-0.15215790946528596,1.7656903765690377,0.0003919360460713506
429,429,150944,1526.64,1534.16, to blend together the digital and physical worlds in this way is we're also going to be able to embody,"[51223, 284, 13516, 1978, 262, 4875, 290, 3518, 11621, 287, 428, 835, 318, 356, 821, 635, 1016, 284, 307, 1498, 284, 48061, 51599]",0.0,-0.15215790946528596,1.7656903765690377,0.0003919360460713506
430,430,153416,1535.0400000000002,1536.96, the AIs as well.,"[50407, 262, 317, 3792, 355, 880, 13, 50503]",0.0,-0.20639134991553523,1.806083650190114,0.0027688750997185707
431,431,153416,1536.96,1541.0400000000002," So I think you'll also have meetings in the future where you're basically, you know,","[50503, 1406, 314, 892, 345, 1183, 635, 423, 8292, 287, 262, 2003, 810, 345, 821, 6209, 11, 345, 760, 11, 50707]",0.0,-0.20639134991553523,1.806083650190114,0.0027688750997185707
432,432,153416,1541.0400000000002,1545.0400000000002, maybe you're sitting there physically and then you have a couple of other people who are there,"[50707, 3863, 345, 821, 5586, 612, 10170, 290, 788, 345, 423, 257, 3155, 286, 584, 661, 508, 389, 612, 50907]",0.0,-0.20639134991553523,1.806083650190114,0.0027688750997185707
433,433,153416,1545.0400000000002,1550.8000000000002, as holograms and then you have like Bob the AI who's an engineer on your team who's helping with things.,"[50907, 355, 31912, 9474, 290, 788, 345, 423, 588, 5811, 262, 9552, 508, 338, 281, 11949, 319, 534, 1074, 508, 338, 5742, 351, 1243, 13, 51195]",0.0,-0.20639134991553523,1.806083650190114,0.0027688750997185707
434,434,153416,1550.8000000000002,1557.6000000000001," And he can now be embodied as a, you know, as a realistic avatar as well and just join the meeting","[51195, 843, 339, 460, 783, 307, 34413, 355, 257, 11, 345, 760, 11, 355, 257, 12653, 30919, 355, 880, 290, 655, 4654, 262, 3249, 51535]",0.0,-0.20639134991553523,1.806083650190114,0.0027688750997185707
435,435,153416,1558.16,1558.72, in that way.,"[51563, 287, 326, 835, 13, 51591]",0.0,-0.20639134991553523,1.806083650190114,0.0027688750997185707
436,436,153416,1558.72,1562.8000000000002, So I think that that's going to be pretty compelling as well.,"[51591, 1406, 314, 892, 326, 326, 338, 1016, 284, 307, 2495, 13206, 355, 880, 13, 51795]",0.0,-0.20639134991553523,1.806083650190114,0.0027688750997185707
437,437,156280,1563.12,1569.44," So then, okay, so what can you do with photorealistic avatars compared to kind of the more expressive","[50379, 1406, 788, 11, 8788, 11, 523, 644, 460, 345, 466, 351, 2825, 39396, 2569, 1196, 40193, 3688, 284, 1611, 286, 262, 517, 38084, 50695]",0.0,-0.1040129260482075,1.7154471544715446,0.0006117885350249708
438,438,156280,1569.44,1576.32," ones that we have today? Well, I think a lot of this actually comes down to acceptance of the","[50695, 3392, 326, 356, 423, 1909, 30, 3894, 11, 314, 892, 257, 1256, 286, 428, 1682, 2058, 866, 284, 13427, 286, 262, 51039]",0.0,-0.1040129260482075,1.7154471544715446,0.0006117885350249708
439,439,156280,1576.32,1583.04," technology. And because all the stuff that we're doing, I mean, the motion of your eyebrows,","[51039, 3037, 13, 843, 780, 477, 262, 3404, 326, 356, 821, 1804, 11, 314, 1612, 11, 262, 6268, 286, 534, 26928, 11, 51375]",0.0,-0.1040129260482075,1.7154471544715446,0.0006117885350249708
440,440,156280,1583.04,1588.08," the motion of your eyes, the cheeks and all of that, there's actually no reason why you couldn't","[51375, 262, 6268, 286, 534, 2951, 11, 262, 25839, 290, 477, 286, 326, 11, 612, 338, 1682, 645, 1738, 1521, 345, 3521, 470, 51627]",0.0,-0.1040129260482075,1.7154471544715446,0.0006117885350249708
441,441,156280,1588.08,1590.0, do that on an expressive avatar too.,"[51627, 466, 326, 319, 281, 38084, 30919, 1165, 13, 51723]",0.0,-0.1040129260482075,1.7154471544715446,0.0006117885350249708
442,442,159000,1590.0,1595.04," I mean, it wouldn't look exactly like you, but you can make a cartoon version of yourself and","[50363, 314, 1612, 11, 340, 3636, 470, 804, 3446, 588, 345, 11, 475, 345, 460, 787, 257, 16251, 2196, 286, 3511, 290, 50615]",0.0,-0.10319477861577814,1.6375545851528384,0.0016670863842591643
443,443,159000,1595.04,1602.64, still have it be almost as expressive. But I do think that there's this bridge between the,"[50615, 991, 423, 340, 307, 2048, 355, 38084, 13, 887, 314, 466, 892, 326, 612, 338, 428, 7696, 1022, 262, 50995]",0.0,-0.10319477861577814,1.6375545851528384,0.0016670863842591643
444,444,159000,1602.64,1607.44, current state of most of our interactions in the physical world and where we're getting in the,"[50995, 1459, 1181, 286, 749, 286, 674, 12213, 287, 262, 3518, 995, 290, 810, 356, 821, 1972, 287, 262, 51235]",0.0,-0.10319477861577814,1.6375545851528384,0.0016670863842591643
445,445,159000,1607.44,1613.36, future with this kind of hybrid physical and digital world where I think it's going to be a lot,"[51235, 2003, 351, 428, 1611, 286, 14554, 3518, 290, 4875, 995, 810, 314, 892, 340, 338, 1016, 284, 307, 257, 1256, 51531]",0.0,-0.10319477861577814,1.6375545851528384,0.0016670863842591643
446,446,161336,1613.36,1620.56, easier for people to kind of take some of these experiences seriously with the photorealistic,"[50363, 4577, 329, 661, 284, 1611, 286, 1011, 617, 286, 777, 6461, 6411, 351, 262, 2825, 39396, 2569, 50723]",0.0,-0.08539797352478568,1.9523809523809523,0.022227715700864792
447,447,161336,1620.56,1624.4799999999998, avatars to start. And then I'm actually really curious to see where it goes longer term. I could,"[50723, 1196, 40193, 284, 923, 13, 843, 788, 314, 1101, 1682, 1107, 11040, 284, 766, 810, 340, 2925, 2392, 3381, 13, 314, 714, 50919]",0.0,-0.08539797352478568,1.9523809523809523,0.022227715700864792
448,448,161336,1624.4799999999998,1629.6, see a world where people stick to the photorealistic and maybe they modify them to make them a little,"[50919, 766, 257, 995, 810, 661, 4859, 284, 262, 2825, 39396, 2569, 290, 3863, 484, 13096, 606, 284, 787, 606, 257, 1310, 51175]",0.0,-0.08539797352478568,1.9523809523809523,0.022227715700864792
449,449,161336,1629.6,1636.1599999999999," bit more interesting, but maybe fundamentally we like photorealistic things. But I can also see a","[51175, 1643, 517, 3499, 11, 475, 3863, 17640, 356, 588, 2825, 39396, 2569, 1243, 13, 887, 314, 460, 635, 766, 257, 51503]",0.0,-0.08539797352478568,1.9523809523809523,0.022227715700864792
450,450,161336,1636.1599999999999,1642.0," world that once people get used to the photorealistic avatars and they get used to these experiences,","[51503, 995, 326, 1752, 661, 651, 973, 284, 262, 2825, 39396, 2569, 1196, 40193, 290, 484, 651, 973, 284, 777, 6461, 11, 51795]",0.0,-0.08539797352478568,1.9523809523809523,0.022227715700864792
451,451,164200,1642.08,1646.48, that I actually think that there could be a world where people actually prefer,"[50367, 326, 314, 1682, 892, 326, 612, 714, 307, 257, 995, 810, 661, 1682, 4702, 50587]",0.0,-0.10337915960347878,1.7164179104477613,0.0014068910386413336
452,452,164200,1648.48,1654.96, being able to express themselves in kind of non ways that aren't so tied to their physical,"[50687, 852, 1498, 284, 4911, 2405, 287, 1611, 286, 1729, 2842, 326, 3588, 470, 523, 8165, 284, 511, 3518, 51011]",0.0,-0.10337915960347878,1.7164179104477613,0.0014068910386413336
453,453,164200,1654.96,1659.92," reality. And so that's one of the things that I'm really curious about. And I don't know, in a","[51011, 3950, 13, 843, 523, 326, 338, 530, 286, 262, 1243, 326, 314, 1101, 1107, 11040, 546, 13, 843, 314, 836, 470, 760, 11, 287, 257, 51259]",0.0,-0.10337915960347878,1.7164179104477613,0.0014068910386413336
454,454,164200,1659.92,1665.2," bunch of our internal experiments on this, one of the things that I thought was psychologically","[51259, 7684, 286, 674, 5387, 10256, 319, 428, 11, 530, 286, 262, 1243, 326, 314, 1807, 373, 39705, 51523]",0.0,-0.10337915960347878,1.7164179104477613,0.0014068910386413336
455,455,164200,1665.2,1671.84, pretty interesting is people have no issues blending photorealistic stuff and not. So we can have a,"[51523, 2495, 3499, 318, 661, 423, 645, 2428, 34863, 2825, 39396, 2569, 3404, 290, 407, 13, 1406, 356, 460, 423, 257, 51855]",0.0,-0.10337915960347878,1.7164179104477613,0.0014068910386413336
456,456,167184,1672.32,1678.8," for this specific scene that we're in now, we happen to sort of being in a dark room. I think","[50387, 329, 428, 2176, 3715, 326, 356, 821, 287, 783, 11, 356, 1645, 284, 3297, 286, 852, 287, 257, 3223, 2119, 13, 314, 892, 50711]",0.0,-0.14016912380854288,1.6581196581196582,0.00014412302698474377
457,457,167184,1679.4399999999998,1683.9199999999998," part of that aesthetic decision, I think was based on the way you like to do your podcast. But we've","[50743, 636, 286, 326, 19713, 2551, 11, 314, 892, 373, 1912, 319, 262, 835, 345, 588, 284, 466, 534, 9905, 13, 887, 356, 1053, 50967]",0.0,-0.14016912380854288,1.6581196581196582,0.00014412302698474377
458,458,167184,1683.9199999999998,1692.32," done experiences like this where you have like a cartoony background, but photorealistic people","[50967, 1760, 6461, 588, 428, 810, 345, 423, 588, 257, 6383, 78, 1647, 4469, 11, 475, 2825, 39396, 2569, 661, 51387]",0.0,-0.14016912380854288,1.6581196581196582,0.00014412302698474377
459,459,167184,1692.32,1698.48, who you're talking to. And we seem to like people just seem to just think that that is completely,"[51387, 508, 345, 821, 3375, 284, 13, 843, 356, 1283, 284, 588, 661, 655, 1283, 284, 655, 892, 326, 326, 318, 3190, 51695]",0.0,-0.14016912380854288,1.6581196581196582,0.00014412302698474377
460,460,169848,1698.56,1703.28," normal. It doesn't bother you, it doesn't feel like it's weird. Another thing that we've","[50367, 3487, 13, 632, 1595, 470, 11393, 345, 11, 340, 1595, 470, 1254, 588, 340, 338, 7650, 13, 6023, 1517, 326, 356, 1053, 50603]",0.0,-0.1433085244277428,1.7383512544802868,0.004078335594385862
461,461,169848,1703.28,1708.8, experienced with is basically you have a photorealistic avatar that you're talking to. And then right,"[50603, 5924, 351, 318, 6209, 345, 423, 257, 2825, 39396, 2569, 30919, 326, 345, 821, 3375, 284, 13, 843, 788, 826, 50879]",0.0,-0.1433085244277428,1.7383512544802868,0.004078335594385862
462,462,169848,1708.8,1715.2," next to them, you have an expressive kind of cartoon avatar. And that actually is pretty normal too.","[50879, 1306, 284, 606, 11, 345, 423, 281, 38084, 1611, 286, 16251, 30919, 13, 843, 326, 1682, 318, 2495, 3487, 1165, 13, 51199]",0.0,-0.1433085244277428,1.7383512544802868,0.004078335594385862
463,463,169848,1715.2,1721.04," Right? It's like, it's not that weird to basically being interacting with different people in","[51199, 6498, 30, 632, 338, 588, 11, 340, 338, 407, 326, 7650, 284, 6209, 852, 24986, 351, 1180, 661, 287, 51491]",0.0,-0.1433085244277428,1.7383512544802868,0.004078335594385862
464,464,169848,1721.04,1725.84, different modes like that. So I'm not sure. I think it'll be an interesting question to what extent,"[51491, 1180, 12881, 588, 326, 13, 1406, 314, 1101, 407, 1654, 13, 314, 892, 340, 1183, 307, 281, 3499, 1808, 284, 644, 6287, 51731]",0.0,-0.1433085244277428,1.7383512544802868,0.004078335594385862
465,465,172584,1725.84,1731.84, these photorealistic avatars are like a key part of just transitioning from being comfortable,"[50363, 777, 2825, 39396, 2569, 1196, 40193, 389, 588, 257, 1994, 636, 286, 655, 37005, 422, 852, 6792, 50663]",0.0,-0.13261931082781622,1.803225806451613,0.0009256487246602774
466,466,172584,1731.84,1736.8799999999999, in the physical world to this kind of new modern real world that that kind of includes both the,"[50663, 287, 262, 3518, 995, 284, 428, 1611, 286, 649, 3660, 1103, 995, 326, 326, 1611, 286, 3407, 1111, 262, 50915]",0.0,-0.13261931082781622,1.803225806451613,0.0009256487246602774
467,467,172584,1736.8799999999999,1742.48," digital and physical, or if this is like the long term way that it stays. That's that's a,","[50915, 4875, 290, 3518, 11, 393, 611, 428, 318, 588, 262, 890, 3381, 835, 326, 340, 14768, 13, 1320, 338, 326, 338, 257, 11, 51195]",0.0,-0.13261931082781622,1.803225806451613,0.0009256487246602774
468,468,172584,1742.48,1745.52," I mean, I think that they're going to be useless for both the expressive and the photorealistic","[51195, 314, 1612, 11, 314, 892, 326, 484, 821, 1016, 284, 307, 13894, 329, 1111, 262, 38084, 290, 262, 2825, 39396, 2569, 51347]",0.0,-0.13261931082781622,1.803225806451613,0.0009256487246602774
469,469,172584,1745.52,1748.6399999999999," over time. I just don't know what the balance is going to be. Yeah, it's a really good,","[51347, 625, 640, 13, 314, 655, 836, 470, 760, 644, 262, 5236, 318, 1016, 284, 307, 13, 9425, 11, 340, 338, 257, 1107, 922, 11, 51503]",0.0,-0.13261931082781622,1.803225806451613,0.0009256487246602774
470,470,172584,1749.1999999999998,1754.3999999999999," interesting philosophical question. But to me in the short term, the photorealistic is amazing","[51531, 3499, 17580, 1808, 13, 887, 284, 502, 287, 262, 1790, 3381, 11, 262, 2825, 39396, 2569, 318, 4998, 51791]",0.0,-0.13261931082781622,1.803225806451613,0.0009256487246602774
471,471,175440,1754.48,1759.1200000000001," to what I would prefer, like you said, the work of them, but like on a beach with a beer,","[50367, 284, 644, 314, 561, 4702, 11, 588, 345, 531, 11, 262, 670, 286, 606, 11, 475, 588, 319, 257, 10481, 351, 257, 6099, 11, 50599]",0.0,-0.17643753051757813,1.6977777777777778,0.0014898177469149232
472,472,175440,1759.8400000000001,1767.3600000000001," just to see a buddy of mine remotely on a chair next to me drinking a beer. I mean, that as","[50635, 655, 284, 766, 257, 24407, 286, 6164, 19863, 319, 257, 5118, 1306, 284, 502, 7722, 257, 6099, 13, 314, 1612, 11, 326, 355, 51011]",0.0,-0.17643753051757813,1.6977777777777778,0.0014898177469149232
473,473,175440,1767.3600000000001,1772.72, realistic as possible is an incredible experience. So I don't want any fake hats on him. I don't want,"[51011, 12653, 355, 1744, 318, 281, 8082, 1998, 13, 1406, 314, 836, 470, 765, 597, 8390, 23910, 319, 683, 13, 314, 836, 470, 765, 51279]",0.0,-0.17643753051757813,1.6977777777777778,0.0014898177469149232
474,474,175440,1772.72,1777.92," any just chilling with it with a friend drinking beer, looking at the ocean while not being in the","[51279, 597, 655, 28010, 351, 340, 351, 257, 1545, 7722, 6099, 11, 2045, 379, 262, 9151, 981, 407, 852, 287, 262, 51539]",0.0,-0.17643753051757813,1.6977777777777778,0.0014898177469149232
475,475,177792,1778.0,1784.72," same place together. I mean, that, that experience is just, it's a fundamentally,","[50367, 976, 1295, 1978, 13, 314, 1612, 11, 326, 11, 326, 1998, 318, 655, 11, 340, 338, 257, 17640, 11, 50703]",0.0,-0.13156050841013592,1.6961538461538461,0.00169258879031986
476,476,177792,1786.96,1790.48," it's just a high quality experience, a friendship, whatever we seek in friendship,","[50815, 340, 338, 655, 257, 1029, 3081, 1998, 11, 257, 14738, 11, 4232, 356, 5380, 287, 14738, 11, 50991]",0.0,-0.13156050841013592,1.6961538461538461,0.00169258879031986
477,477,177792,1790.48,1794.48, it seems to be present there in the same kind of realism I'm seeing right now.,"[50991, 340, 2331, 284, 307, 1944, 612, 287, 262, 976, 1611, 286, 30787, 314, 1101, 4379, 826, 783, 13, 51191]",0.0,-0.13156050841013592,1.6961538461538461,0.00169258879031986
478,478,177792,1794.48,1800.16," This is totally a game changer. So to me, this is, I can see myself sticking with this for a long","[51191, 770, 318, 6635, 257, 983, 1488, 263, 13, 1406, 284, 502, 11, 428, 318, 11, 314, 460, 766, 3589, 17274, 351, 428, 329, 257, 890, 51475]",0.0,-0.13156050841013592,1.6961538461538461,0.00169258879031986
479,479,177792,1800.16,1806.72," time. Yeah, and I mean, it's also, it's novel, and it's also a technological feat, right? It's like","[51475, 640, 13, 9425, 11, 290, 314, 1612, 11, 340, 338, 635, 11, 340, 338, 5337, 11, 290, 340, 338, 635, 257, 14614, 2218, 11, 826, 30, 632, 338, 588, 51803]",0.0,-0.13156050841013592,1.6961538461538461,0.00169258879031986
480,480,180672,1806.72,1811.44," being able to pull this off is like, it's like a pretty impressive, and I think to some degree,","[50363, 852, 1498, 284, 2834, 428, 572, 318, 588, 11, 340, 338, 588, 257, 2495, 8036, 11, 290, 314, 892, 284, 617, 4922, 11, 50599]",0.0,-0.20548272600360945,1.6271186440677967,0.001476480276323855
481,481,180672,1811.44,1816.8," it's just this kind of like awesome experience. But I'm already sorry to interrupt, I'm already","[50599, 340, 338, 655, 428, 1611, 286, 588, 7427, 1998, 13, 887, 314, 1101, 1541, 7926, 284, 11313, 11, 314, 1101, 1541, 50867]",0.0,-0.20548272600360945,1.6271186440677967,0.001476480276323855
482,482,180672,1817.3600000000001,1826.24," forgetting that you're not real. Like this really, so novel. It's just an average version of me.","[50895, 32012, 326, 345, 821, 407, 1103, 13, 4525, 428, 1107, 11, 523, 5337, 13, 632, 338, 655, 281, 2811, 2196, 286, 502, 13, 51339]",0.0,-0.20548272600360945,1.6271186440677967,0.001476480276323855
483,483,180672,1826.24,1830.88," That's a deep philosophical question. Yes. But I mean, but here's some of the, so I put this on","[51339, 1320, 338, 257, 2769, 17580, 1808, 13, 3363, 13, 887, 314, 1612, 11, 475, 994, 338, 617, 286, 262, 11, 523, 314, 1234, 428, 319, 51571]",0.0,-0.20548272600360945,1.6271186440677967,0.001476480276323855
484,484,183088,1830.88,1836.96," this morning and I was like, all right, like, it's like, okay, so this, my hair is a little shorter","[50363, 428, 3329, 290, 314, 373, 588, 11, 477, 826, 11, 588, 11, 340, 338, 588, 11, 8788, 11, 523, 428, 11, 616, 4190, 318, 257, 1310, 12238, 50667]",0.0,-0.11951205224701852,1.7031802120141342,0.029901551082730293
485,485,183088,1836.96,1841.6000000000001," in this than my physical hair is right now. I probably need to go get a haircut. And like,","[50667, 287, 428, 621, 616, 3518, 4190, 318, 826, 783, 13, 314, 2192, 761, 284, 467, 651, 257, 45548, 13, 843, 588, 11, 50899]",0.0,-0.11951205224701852,1.7031802120141342,0.029901551082730293
486,486,183088,1842.24,1846.72," and I actually did happen to shave this morning, but if I hadn't, you know, I could still have","[50931, 290, 314, 1682, 750, 1645, 284, 34494, 428, 3329, 11, 475, 611, 314, 8020, 470, 11, 345, 760, 11, 314, 714, 991, 423, 51155]",0.0,-0.11951205224701852,1.7031802120141342,0.029901551082730293
487,487,183088,1846.72,1852.3200000000002," this photorealistic avatar that is, that is more cleanly shaven, right? Even if I'm, you know, a few","[51155, 428, 2825, 39396, 2569, 30919, 326, 318, 11, 326, 318, 517, 3424, 306, 427, 4005, 11, 826, 30, 3412, 611, 314, 1101, 11, 345, 760, 11, 257, 1178, 51435]",0.0,-0.11951205224701852,1.7031802120141342,0.029901551082730293
488,488,183088,1852.3200000000002,1859.68, days in physically. So I do think that they're going to start to be these subtle questions that,"[51435, 1528, 287, 10170, 13, 1406, 314, 466, 892, 326, 484, 821, 1016, 284, 923, 284, 307, 777, 11800, 2683, 326, 51803]",0.0,-0.11951205224701852,1.7031802120141342,0.029901551082730293
489,489,185968,1859.68,1866.48, seep in where the avatar is realistic in the sense of this is kind of what you looked like at,"[50363, 384, 538, 287, 810, 262, 30919, 318, 12653, 287, 262, 2565, 286, 428, 318, 1611, 286, 644, 345, 3114, 588, 379, 50703]",0.0,-0.12224912643432617,1.7230769230769232,0.0012639656197279692
490,490,185968,1866.48,1872.16," the time of capture, but it's not necessarily temporarily accurate to exactly what you look","[50703, 262, 640, 286, 8006, 11, 475, 340, 338, 407, 6646, 13413, 7187, 284, 3446, 644, 345, 804, 50987]",0.0,-0.12224912643432617,1.7230769230769232,0.0012639656197279692
491,491,185968,1872.16,1877.68, like in this moment. And I think that we're going to end up being a bunch of questions,"[50987, 588, 287, 428, 2589, 13, 843, 314, 892, 326, 356, 821, 1016, 284, 886, 510, 852, 257, 7684, 286, 2683, 51263]",0.0,-0.12224912643432617,1.7230769230769232,0.0012639656197279692
492,492,185968,1878.72,1882.24, that come from that over time that I think are going to be fascinating too.,"[51315, 326, 1282, 422, 326, 625, 640, 326, 314, 892, 389, 1016, 284, 307, 13899, 1165, 13, 51491]",0.0,-0.12224912643432617,1.7230769230769232,0.0012639656197279692
493,493,185968,1882.24,1887.3600000000001," You mean just like the nature of identity of who we are? Are we the people, you know, how people do","[51491, 921, 1612, 655, 588, 262, 3450, 286, 5369, 286, 508, 356, 389, 30, 4231, 356, 262, 661, 11, 345, 760, 11, 703, 661, 466, 51747]",0.0,-0.12224912643432617,1.7230769230769232,0.0012639656197279692
494,494,188736,1887.9199999999998,1893.4399999999998," like summer beach body with people be for the scan, they'll try to lose some way and look their","[50391, 588, 3931, 10481, 1767, 351, 661, 307, 329, 262, 9367, 11, 484, 1183, 1949, 284, 4425, 617, 835, 290, 804, 511, 50667]",0.0,-0.17319307829204358,1.7366412213740459,0.0008830918231979012
495,495,188736,1893.4399999999998,1900.4799999999998," best and sexiest with the nice hair and everything like that. I mean, it does, it does raise the","[50667, 1266, 290, 1714, 6386, 351, 262, 3621, 4190, 290, 2279, 588, 326, 13, 314, 1612, 11, 340, 857, 11, 340, 857, 5298, 262, 51019]",0.0,-0.17319307829204358,1.7366412213740459,0.0008830918231979012
496,496,188736,1900.4799999999998,1906.0," question of, you know, if a lot of people interacting with the digital version of ourselves, who are","[51019, 1808, 286, 11, 345, 760, 11, 611, 257, 1256, 286, 661, 24986, 351, 262, 4875, 2196, 286, 6731, 11, 508, 389, 51295]",0.0,-0.17319307829204358,1.7366412213740459,0.0008830918231979012
497,497,188736,1906.0,1910.9599999999998, we really are we the entity driving the avatar or are we the avatar?,"[51295, 356, 1107, 389, 356, 262, 9312, 5059, 262, 30919, 393, 389, 356, 262, 30919, 30, 51543]",0.0,-0.17319307829204358,1.7366412213740459,0.0008830918231979012
498,498,188736,1911.9199999999998,1916.1599999999999," Well, I mean, I think our physical body is also fluctuating change over time too. So I think","[51591, 3894, 11, 314, 1612, 11, 314, 892, 674, 3518, 1767, 318, 635, 19180, 11927, 1487, 625, 640, 1165, 13, 1406, 314, 892, 51803]",0.0,-0.17319307829204358,1.7366412213740459,0.0008830918231979012
499,499,191616,1916.16,1922.3200000000002," there's a similar question of like, which version of that are we, right? There's like the, I mean,","[50363, 612, 338, 257, 2092, 1808, 286, 588, 11, 543, 2196, 286, 326, 389, 356, 11, 826, 30, 1318, 338, 588, 262, 11, 314, 1612, 11, 50671]",0.0,-0.13417109505074923,1.926530612244898,0.0003043123579118401
500,500,191616,1922.3200000000002,1928.16," it's an interesting identity question because all right, it's like, I don't know, it's like","[50671, 340, 338, 281, 3499, 5369, 1808, 780, 477, 826, 11, 340, 338, 588, 11, 314, 836, 470, 760, 11, 340, 338, 588, 50963]",0.0,-0.13417109505074923,1.926530612244898,0.0003043123579118401
501,501,191616,1928.16,1932.64," weight fluctuates or things like that. It's like, I think most people don't tend to think of","[50963, 3463, 19180, 12632, 393, 1243, 588, 326, 13, 632, 338, 588, 11, 314, 892, 749, 661, 836, 470, 4327, 284, 892, 286, 51187]",0.0,-0.13417109505074923,1.926530612244898,0.0003043123579118401
